author,keyword,link,publish_date,source,title,cleaned_content,is_valid
Aryo Mahendro - detikBali,banjir klungkung bali,https://www.detik.com/bali/berita/d-8177153/rencana-pasang-alarm-banjir-di-bali-butuh-perencanaan-dan-waktu-lama,2025-10-24 19:32:00,detik.com,"
        Rencana Pasang Alarm Banjir di Bali Butuh Perencanaan dan Waktu Lama    ",denpasar empat sungai di empat kabupaten dan kota yakni tukad badung denpasar tukad ayung gianyar tukad unda klungkung dan tukad mati badung bakal dipasangi alarm peringatan dini bencana mulai 2026 namun pemasang alarm itu butuh waktu anggaran dan perencanaan yang lebih lamaalarm peringatan dini itu memang kebutuhan tapi tidak bisa serta merta karena ada perencanaan penganggaran dan eksekusi kata kepala bpbd provinsi bali i gede agung teja bhusana yadnya saat pengukuhan dan peresmian layanan itu di kantornya jumat 24102025baca juga bpbd bali resmikan unit disabilitas penanggulangan bencana didukung australia scroll to continue with content teja mengatakan kondisi curah hujan dan kedalaman sungai di tiap daerah itu berbeda sehingga tidak memungkinkan untuk sekadar membunyikan alarmpun kalau air sungai meluap hingga memicu alarm berbunyi perlu direncanakan prosedur evakuasi warga yang berada di dekat sungai sebelum itu juga perlu menentukan pengaturan alarm di ketinggian air berapa meter alarm itu akan terpicu advertisement jadi ada perencanaan dan perhitungannya dahulu alarm tidak akan dipasang dipasang pada puncak musim hujan 2026 nanti kita lihat kata tejasementara belum ada alarm masih ada aplikasi whatsapp yang dapat dimanfaatkan sebagai media peringatan dini bencana alam teja juga menyarankan cara tradisional dengan memukul kentongan kulkul untuk memperingatkan warga agar mengungsi sebelum terdampak bencanasistem informasi peringatan dini sudah konsisten disampaikan alarm belum ada peringatan dapat disampaikan melalui grup whatsapp peringatan dengan memukul kulkul di banjar itu juga bisa katanyabaca juga cegah banjir bandang terulang ribuan pohon akan ditanam di 3 das denpasardiberitakan sebelumnya gubernur bali wayan koster berencana memasang alarm peringatan dini di empat sungai itu fungsinya mengantisipasi dampak dini yang bisa ditimbulkan ketika curah hujan mulai tinggipemasangan alarm di sungai rencananya dilakukan pada 2026 teknisnya bisa melibatkan balai wilayah sungai bws balipenida atau pemkabpemkot maupun provinsi karena sungai tersebut tidak hanya melintasi satu kabupaten video ri dorong percepatan sistem peringatan dini global di kongres luar biasa wmo video ri dorong percepatan sistem peringatan dini global di kongres luar biasa wmo hsahsa alarm banjir peringatan dini bali penganggaran perencanaan bencana tukad badung tukad ayung tukad unda,True
"Sui Suadnyana, Rizki Setyo - detikTravel",banjir klungkung bali,https://travel.detik.com/travel-news/d-8107343/bali-banjir-parah-dprd-bali-dorong-tata-kelola-pembangunan-dibenahi,2025-09-11 18:30:00,detik.com,"
        Bali Banjir Parah, DPRD Bali Dorong Tata Kelola Pembangunan Dibenahi    ",denpasar wagub bali i nyoman giri prasta mengakui pembangunan masif jadi salah satu faktor penyebab banjir bali dprd pun mendorong tata kelola pembangunan dibenahipasti pasti ada dampak pembangunan masif semuanya ada dampak kata giri prasta usai meninjau posko pengungsian korban banjir di denpasar seperti dikutip antara kamis 1192025dewan perwakilan rakyat daerah dprd bali pun mendorong pemerintah provinsi maupun kabupatenkota agar segera membenahi tata kelola bangunan di bagian hulu scroll to continue with content pembenahan itu perlu dilakukan setelah banjir parah di sejumlah daerah di bali pada rabu 1092025 tercatat sudah banyak korban jatuh akibat banjir tersebuttata kelola di hulu harus dibenahi coba kita lihat sungaisungai dan gotgot diperkecil oleh pembangunan kata wakil ketua dprd bali ida gede komang kresna budi kamis 1192025 advertisement baca juga mengenal gelombang ekuatorial rossby yang bikin bali dikepung banjirsampaisampai jalan subak saja bisa hilang ungkapnyakresna menilai badan pertanahan nasional bpn bali seharusnya mengetahui batas sempadan dan semuanya harus terverifikasimenurutnya perlu adanya revitalisasi bangunanbangunan di sempadan sungai dari hulu ke hilir contohnya seperti toko di jalan sulawesikader partai golongan karya golkar itu mengatakan setiap kabupatenkota memiliki tanggung jawabnya masingmasing yang dikomandoi oleh pemprov balipenting sinergitas dibangun sambung kresna budibaca juga banjir bali pulau dewata darurat bencanabadan nasional penanggulangan bencana bnpb mencatat 120 titik banjir yang menerjang tujuh kabupatenkota di bali rinciannya denpasar sebanyak 81 titik banjir gianyar 14 titik badung 12 titik tabanan delapan titik kemudian karangasem dan jembrana masingmasing empat titik dan klungkung satu titiksementara itu sejumlah warga mengungsi di beberapa titik pos pengungsian bpbd bali menginformasikan 562 warga mengungsi dengan rincian 327 warga di kabupaten jembrana dan 235 warga di kota denpasar beber kepala pusat data informasi dan komunikasi kebencanaan bnpb abdul muhari dalam keterangan persnya kamis 1192025bnpb juga merilis update korban tewas bencana banjir di bali pada rabu 1092025 berdasarkan data bnpb tercatat sebanyak 14 korban tewas dan dua masih dalam pencariandata sementara per kamis 11 september 2025 pukul 1100 wib total korban meninggal meninggal dunia yang sudah ditemukan berjumlah 14 jiwa dan yang masih dalam pencarian sebanyak dua warga terang abdul menurutnya dua korban yang hilang teridentifikasi di denpasarartikel ini telah naik di detikbali video bicara soal banjir menteri lh soroti daerah aliran sungai bali video bicara soal banjir menteri lh soroti daerah aliran sungai bali wswwsw banjir bali tata kelola pembangunan bali,True
Ni Komang Ayu Leona Wirawan - detikBali,banjir klungkung bali,https://www.detik.com/bali/berita/d-8153665/bpbd-bali-serahkan-bansos-bencana-alam-ke-klungkung-bangli,2025-10-09 22:09:00,detik.com,"
        BPBD Bali Serahkan Bansos Bencana Alam ke Klungkung-Bangli    ",klungkung kepala pelaksana kalaksa badan penanggulangan bencana daerah bpbd bali gede teja menyerahkan bantuan kepada masyarakat klungkung dan bangli yang terdampak bencana alam di kantor bupati klungkung kamis 9102025total 31 penerima manfaat yang hadir untuk secara simbolis diberikan bansos bantuan sosial mereka merupakan masyarakat yang rumah tembok pekarangan hingga fasilitas umum di desanya yang mengalami kerusakan akibat banjir dan tanah longsor rabu 1092025 dana bansos sudah mendahului diberikan ke rekening masingmasing rabu 1102025baca juga pemprov bali dan bmkg petakan langkah mitigasi bencana musim hujan scroll to continue with content sudah terima bantuan 1 oktober kemarin nggih bencana itu menimpa 67 kabupaten yang relatif aman ketika itu adalah buleleng dan denpasar yang paling terdampak saya menyampaikan permohonan maaf tidak bisa secara langsung ikut mendampingi temanteman di kabupatenkota dalam pelayanan bencana saat itu karena sumber daya kami di provinsi bali banyak fokus menangani denpasar ucap tejateja menilai klungkung paling responsif pemerintah kabupaten pemkab klungkung hingga masyarakat dinilai sigap mendata dan melakukan asesmen sehingga pemerintah provinsi pemprov bali bisa segera membantu kecekatan pendataan juga terjadi di kabupaten bangli dan tabanan advertisement sisi lain bupati klungkung i made satria juga menyatakan apresiasi berbagai pihak yang menjadi garda terdepan dalam evakuasi pengamanan dan pemulihan bencana alam bansos dari pemprov kemudian diharapkan menjadi upaya meringankan beban sekaligus mendorong semangat bangkit masyarakatbantuan ini tidak hanya meringankan beban masyarakat tetapi juga simbol kehadiran dan kepedulian pemerintah di tengah duka yan dialami saya yakin semangat dan optimisme masyarakat untuk bangkit kembali semakin kuat berkat adanya perhatian dari pemprov bali imbuh satriaadapun total nominal yang diserahkan dari program bali peduli bencana sebesar rp 533 juta untuk wilayah klungkung yang mana termasuk bantuan senilai rp 58 juta untuk dua orang yang berasal dari bangli dana rp 58 juta itu akan dipergunakan untuk memperbaiki pura taman dan subak tengalinmenurut satria banjir dan tanah longsor bukan sebatas musibah namun juga sinyal untuk meningkatkan kesiapsiagaan bencana guna mengurangi kerugian lebih besar lagi bersamaan dengan itu teja juga mengingatkan potensi bahaya pada musim hujan mendatanghujan lebat kemarin bukan di musim hujan malahan oktober ini yang mulai musim hujan tapi tidak kompak di seluruh wilayah di bali puncaknya pada januarifebruari 2026 nah berkaca dari kemarin kita harus mitigasi bencana untuk mengurangi sebisa mungkin tidak terulang imbau tejaseluruh perbekel yang hadir diimbau untuk mengajak masyarakat di desanya melakukan langkah antisipasi berupa pembersihan di jalurjalur sungai dan drainase penanaman pohon pada saat tumpek wariga hingga rutin mengecek peringatan dini di hp maupun aplikasi bmkg video penyebab 3 juta keluarga belum terima bansos video penyebab 3 juta keluarga belum terima bansos hsahsa bansos bencana alam klungkung bangli pemprov bali bantuan sosial penanggulangan bencana mitigasi bencana,True
Rizky Setyo Samudero - detikTravel,banjir klungkung bali,https://travel.detik.com/travel-news/d-8106308/banjir-bali-pulau-dewata-darurat-bencana,2025-09-11 07:07:00,detik.com,"
        Banjir Bali: Pulau Dewata Darurat Bencana    ",jakarta badan nasional penanggulangan bencana bnpb dan pemerintah provinsi pemprov bali menetapkan status darurat bencana selama satu pekan untuk pulau dewata penetapan status itu menyusul terjadinya banjir yang merenggut korban jiwa di beberapa wilayah bali rabu 1092025tadi diskusi semula tanggap darurat bencana itu akan ditetapkan dua minggu tetapi karena sigap bencananya ternyata tidak terlalu besar maka akan diralat menjadi cukup satu minggu kata kepala bnpb letjen tni suharyanto seusai rapat koordinasi di rumah jabatan gubernur bali jayasabha denpasar rabu malam dilansir detikbali suharyanto mengimbau agar warga bali tidak panik dengan penetapan status darurat bencana itu dia mengatakan status itu tidak terkait ketidakmampuan kepala daerah untuk menangani bencana di daerahnya scroll to continue with content baca juga pray for bali dilanda banjir terparah satu dekade 9 orang tewas turis dievakuasistatus darurat ini tidak ada kaitannya dengan kemampuan menangani bencana seorang pemimpin karena terkait bencana itu tidak ada pemimpin sehebat apapun bisa menangani bencana itu secara sendirian kata suharyanto advertisement suhartoyo menegaskan status darurat bukan berarti situasi genting atau luar biasa di suatu daerah dia bilang pemerintah pusat hingga kabupatenkota akan berkolaborasi memberikan bantuan kepada masyarakat yang terdampak banjir di balidia menyebut bahwa penetapan status tanggap darurat diperlukan agar pemerintah pusat bisa membantu penanganan dampak bencanasalah satu persyaratannya adalah pemerintah daerah meminta bantuan itu suratnya ada namanya siaga darurat dan tanggap darurat kata diabanjir bali kali ini memang begitu dahsyat berdasarkan data per rabu petang banjir itu melanda enam kabupatenkota yakni kota denpasar kabupaten jembrana gianyar klungkung badung dan tabananbanjir itu telah menelan sembilan orang tewas dan dua orang dinyatakan hilang 5 orang meninggal di denpasar jembrana 2 gianyar 1 dan badung 1 bnpb juga mencatat sebanyak 202 kepala keluarga kk atau 620 jiwa terdampak banjir akibat hujan deras yang mengguyur wilayah bali sejak selasa 99tidak hanya permukiman yang diterjang banjir namun hotel dan penginapan tak luput dari banjir itu turisturis ikut dievakuasi dengan perahu karetsaat ini bandara i gusti ngurah rai namun sulit dijangkau karena jalan tergenang banyak jalan utama menuju pusat wisata kuta seminyak gianyarubud lumpuh totalbaca juga bali terendam banjir bandara ngurah rai beroperasi normalselengkapnya klik di sini video bicara soal banjir menteri lh soroti daerah aliran sungai bali video bicara soal banjir menteri lh soroti daerah aliran sungai bali femfem banjir bali bali banjir,True
"Sui Suadnyana, Krisna Pradipta - detikBali",banjir klungkung bali,https://www.detik.com/bali/berita/d-8141348/4-sungai-besar-di-bali-bakal-dipasangi-alarm-banjir,2025-10-02 13:27:00,detik.com,"
        4 Sungai Besar di Bali Bakal Dipasangi Alarm Banjir    ",tabanan empat sungai atau tukad besar di bali bakal dipasangi alarm banjir keempat sungai tersebut adalah tukad badung denpasar tukad mati badung tukad unda klungkung dan tukad ayung gianyarpemasangan alarm di sungai sebagai salah satu upaya mitigasi bencana langkah ini untuk mengantisipasi dampak dini yang bisa ditimbulkan ketika curah hujan mulai tinggijadi nanti ada peralatan khusus yang mendeteksi ketinggian air saat curah hujan tinggi pada ketinggian tertentu nanti alat tersebut mengeluarkan bunyi peringatan kata koster seusai pemberian bantuan korban banjir di gedung kesenian i ketut maria tabanan kamis 2102025 scroll to continue with content baca juga pupr ungkap biang kerok banjir denpasar alih fungsi lahansampahpemasangan alarm di sungai rencananya dilakukan pada 2026 teknisnya bisa melibatkan balai wilayah sungai bws balipenida atau pemkabpemkot maupun provinsi karena sungai tersebut tidak hanya melintasi satu kabupaten advertisement selain pemasangan alarm banjir pemprov bali juga melakukan mitigasi lain seperti normalisasi sungai mengaudit wilayah sungai dari hulu hingga hilir serta memantau daerah aliran sungai dassaat ini terjadi pendangkalan sungai di das dan itu harus dikeruk kalau ada daerah yang gundul di wilayah das wajib direboisasi dan direvitalisasi ujar kosterbaca juga pemprov dan dprd bali sepakat pasang alarm sungai untuk deteksi banjirpengamatan koster aliran sepanjang tukad badung banyak terjadi pelanggaran rencana tata ruang wilayah rtrw yakni bangunan yang berdiri di sampingsempadan sungaibangunan itu kan sudah ada turun temurun dan waktu itu belum ada peraturan soal larangan membangun di sepanjang aliran sungai kalau sekarang membangun di samping sungai jelas tidak boleh pasti kami atensi ke depannya tegas koster video dua remaja hilang di sungai gelar bali satu ditemukan tewas video dua remaja hilang di sungai gelar bali satu ditemukan tewas iwsiws sungai bali alarm banjir tukad badung tukad mati tukad unda tukad ayung,True
Femi Diah - detikTravel,banjir klungkung bali,https://travel.detik.com/travel-news/d-8114320/bmkg-banjir-bali-bukan-cuma-karena-curah-hujan-tinggi,2025-09-16 11:45:00,detik.com,"
        BMKG: Banjir Bali Bukan Cuma karena Curah Hujan Tinggi    ",jakarta badan meteorologi klimatologi dan geofisika bmkg menyebuut bahwa banjir bali menjadi banjir terparah dalam satu dekade penyebabnya bukan cuma curah hujan namun juga faktor lainbali terendam banjir selama dua hari pada 910 september sebanyak itu merendam tujuh kabupatenkota dengan lebih dari 120 titik banjirdenpasar menjadi wilayah dengan jumlah titik terbanyak mencapai 81 titik kemudian disusul gianyar 14 titik badung 12 titik tabanan 8 titik karangasem dan jembrana masingmasing 4 titik serta klungkung di kecamatan dawan scroll to continue with content bmkg melaporkan curah hujan harian ekstrem menjadi pemicu utama banjir besar tersebut curah hujan di bali saat itu mencapai lebih dari 300 mm hujan di bali itu termasuk dalam kategori hujan sangat lebat dengan lebih dari 100 mm per hari di jembrana curah hujan tercatat mencapai 3855 mm disusul tampak siring 3738 mm karangasem 3166 mm klungkung 296 mm dan abiansemal 2846 mm bahkan beberapa titik lain seperti denpasar barat petang kerambitan dan padangbai juga mencatat curah hujan di atas 200 mm per hari advertisement baca juga bnpb beri alarm banjir besar di bali berpotensi terulangkepala bmkg dwikorita karnawati intensitas hujan ekstrem bali dipicu oleh kombinasi faktor regional dan lokalaktivitas maddenjulian oscillation mjo gelombang kelvin dan rossby ekuator yang aktif bersamaan dengan kondisi atmosfer labil di bali memperbesar risiko terbentuknya awan konvektif secara masif kata dwikorita dalam laman bmkg dikutip selasa 1692025alih lahan sampah selain akibat dinamika atmosfer bmkg juga menyoroti faktor lingkungan dan infrastruktur sistem drainase di beberapa wilayah dinilai belum mampu menyalurkan volume air hujan yang sangat besarkondisi ini diperparah oleh sedimentasi dan sampah yang menyumbat saluran air lahan yang awalnya berupa area resapan juga telah diubah menjadi area pemukiman dan komersialbmkg mengklaim telah mengeluarkan peringatan sejak 5 september 2025 melalui prospek cuaca sepekan selain itu bmkg juga telah mengeluarkan peringatan dini tiga harian dan setiap jambmkg telah mengeluarkan peringatan sejak 5 september 2025 melalui prospek cuaca sepekan diperkuat dengan peringatan dini tiga harian hingga pembaruan secara jamjaman melalui sistem nowcasting pada saat hujan ekstrem mulai terjadi tulis bmkg dalam laman resminyabaca juga temuan klh alih fungsi lahan di sepanjang das bali terjadi sejak 2015 video bicara soal banjir menteri lh soroti daerah aliran sungai bali video bicara soal banjir menteri lh soroti daerah aliran sungai bali femfem banjir bali bmkg,True
Tri Widiyanti - detikBali,banjir klungkung bali,https://www.detik.com/bali/berita/d-6641280/astungkara-angka-bencana-di-bali-turun-jadi-109-kasus-per-maret-2023,2023-03-27 20:45:00,detik.com,"
        Astungkara, Angka Bencana di Bali Turun Jadi 109 Kasus per Maret 2023    ",denpasar badan penanggulangan bencana daerah bpbd bali mencatat data kebencanaan per maret 2023 turun menjadi 109 kasus dibandingkan februari 2023 sebanyak 245 kasus dari jumlah tersebut bencana longsor mendominasikepala pelaksana bpbd bali i made rentin menghimpun data dari bpbd kabupatenkota di provinsi bali dalam periode 25 februari hingga 25 maretkejadian bencana ini didominasi tanah longsor yakni sebanyak 24 kejadian tutur rentin dalam keterangan resminya senin 2732023 scroll to continue with content baca juga gunung ili lewotolok 32 kali erupsi disertai lontaran lava pijarselanjutnya sambung dia insiden kebakaran terutama terjadi pada gedung menjadi jumlah bencana tertinggi kedua di bali setelah tanah longsordisusul cuaca ekstrem sebanyak 13 kejadian banjir delapan kejadian kebakaran lahanhutan satu kejadian abrasi satu kejadian dan 47 kejadian lainlain advertisement adapun berdasarkan lokasinya bencana terbanyak terjadi di kabupaten buleleng yaitu sebanyak 35 kasus lalu badung sebanyak 23 kasus karangasem 14 kasus tabanan 11 kasusbaca juga cegah ispa warga dekat gunung ili lewotolok pakai maskerkemudian jembrana 10 kasus gianyar delapan kasus bangli dan klungkung tiga kasus serta dua insiden di denpasarberdasarkan data di atas terjadi penurunan jumlah kejadian bencana dari 245 kasus pada februari 2023 menjadi 109 kasus pada maret 2023 terang rentindia mengimbau masyarakat untuk tetap waspada meskipun memasuki kemarau pada april nanti ancaman yang harus diwaspadai antara lain tanah longsor pohon tumbang dan genangan air di jalan video jalan arah gunung salak bogor longsor lagi saat tengah perbaikan video jalan arah gunung salak bogor longsor lagi saat tengah perbaikan birirb bpbd bencana tanah longsor,True
Ni Made Lastri Karsiani Putri - detikBali,banjir klungkung bali,https://www.detik.com/bali/berita/d-8110382/menpar-respons-travel-warning-australia-imbas-banjir-di-bali,2025-09-13 16:29:00,detik.com,"
        Menpar Respons Travel Warning Australia Imbas Banjir di Bali    ",denpasar pemerintah australia kembali mengeluarkan travel warning bagi warganya yang hendak berlibur ke bali imbauan itu disampaikan menyusul banjir besar yang melanda sejumlah wilayah di pulau dewatamenanggapi hal tersebut menteri pariwisata widiyanti putri wardhana mengatakan travel warning adalah kewajiban suatu negara untuk mengingatkan warganya saat bepergian ke luar negeri ia menegaskan pemprov bali sudah berupaya memperbaiki situasi pascabanjirsekarang insyaallah sudah berjalan dengan baik dan beroperasi dengan baik bisa menerima wisatawan dari australia dan dari mana pun untuk datang ke bali bali kondusif ujarnya saat ditemui di pasar kumbasari denpasar sabtu 1392025 scroll to continue with content baca juga menpar tunjuk plt dirut baru untuk badan otoritas labuan bajo floreswidiyanti menegaskan banjir tak berdampak pada sektor pariwisata penerbangan dan hotel tetap berjalan normal advertisement bahkan sedang penuh sekali keadaan normal maka hari ini kami hadir untuk memberikan statement publik dan statement kepada wisatawan bahwa bali ini baikbaik saja katanyamenurutnya wisatawan tetap diterima dengan baik sembari dilakukan perbaikan infrastruktur pascabanjirwidiyanti meninjau pasar kumbasari yang terdampak banjir dari hasil pantauan area basement dan lantai satu terendam air sementara lantai dua yang khusus menjual produk kesenian tidak terdampakia menambahkan pemprov bali sedang menghitung dampak ekonomi akibat banjir pemerintah juga membahas kemungkinan adanya penggantian kerugian bagi masyarakat yang bekerja di pasar tersebutsebelumnya konsulat jenderal australia di bali mengimbau warganya tetap waspada menyusul banjir besar di pulau dewata warga australia diminta mematuhi arahan otoritas setempat dan mengutamakan keselamatan saat beraktivitas di balibaca juga usai tinjau pascabanjir prabowo titip pesan untuk terus promosikan balibanjir besar melanda bali pada rabu 1092025 setelah hujan deras sejak selasa 992025 bpbd bali mencatat ada 120 titik banjir di tujuh kabupatenkota rinciannya denpasar 81 titik gianyar 14 titik badung 12 titik tabanan delapan titik karangasem empat titik jembrana empat titik dan klungkung satu titiktotal pengungsi mencapai 562 orang terdiri atas 327 warga jembrana dan 235 penduduk denpasar hingga jumat 1292025 siang jumlah korban tewas akibat banjir bertambah menjadi 18 orang video mengapa sektor wisata malaysia jadi nomor satu di asean video mengapa sektor wisata malaysia jadi nomor satu di asean dpwdpw travel warning banjir bali pariwisata bali menteri pariwisata keselamatan wisatawan dampak banjir infrastruktur bali pemulihan pascabanjir wisatawan australia,True
Rizki Setyo Samudero - detikTravel,banjir klungkung bali,https://travel.detik.com/travel-news/d-8108253/banjir-bali-dikaitkan-dengan-alih-guna-lahan-koster-menepis,2025-09-12 10:15:00,detik.com,"
        Banjir Bali Dikaitkan dengan Alih Guna Lahan, Koster Menepis    ",denpasar alih fungsi lahan dari ruang hijau menjadi bangunan beton yang masif di bali disebutsebut sebagai salah satu penyebab banjir besar di bali pada 10 september 2025 gubernur bali wayan koster menepisnyabanjir itu menerjang enam kabupatenkota di bali yakni denpasar jembrana gianyar klungkung badung dan tabanan banjir tersebut juga menyebabkan 16 orang meninggal dan ratusan orang terdampaksaat ini banjir telah surut menteri koordinator bidang infrastruktur dan pembangunan kewilayahan agus harimurti yudhoyono ahy dan sejumlah pakar lingkungan menduga banjir besar itu diakibatkan salah satunya oleh alih fungsi lahan dari ruang hijau menjadi bangunan beton termasuk bangunanbangunan yang disebutsebut untuk mendukung pariwisata scroll to continue with content koster menyampaikan pendapat berbeda dia mengatakan alih fungsi lahan lebih banyak terjadi di wilayah badung dan gianyar bukan di denpasarbaca juga pray for bali dilanda banjir terparah satu dekade 9 orang tewas turis dievakuasi advertisement baca juga ahy minta banjir bali cepat ditangani singgung tata ruang berkedok pariwisatanggak juga alih fungsi lahan kan di badung gianyar di badung alih fungsi lahan di daerahdaerah kuta utara ini denpasar kan jauh kata koster saat ditemui di lokasi pembongkaran ruko terdampak banjir di jalan sulawesi denpasar dilansir detikbali jumat 1292025koster menegaskan banjir di denpasar tidak ada kaitannya dengan alih fungsi lahan dia berpatokan kepada lokasi denpasar yang merupakan hilir dari aliran sungai badunggubernur bali dua periode itu berencana menelusuri sungaisungai besar di denpasar dari hulu ke hilir hal itu sebagai langkah evaluasi penyebab banjir yang menerjang denpasar dan sekitarnya ia berharap hal itu juga dapat menjadi bahan mengambil keputusan terbaik untuk penanganan banjir di baliapakah di hulu sungainya ada kerusakan terkait ekosistem ujar kosterya deretan ruko di kawasan heritage denpasar jalan sulawesi denpasar bali dihancurkan setelah roboh dilanda banjir empat orang dilaporkan tewas saat ruko tersebut roboh detikdetik saat bangunan ruko itu roboh diterjang banjir sempat viral di media sosialpantauan detikbali di lokasi beberapa ruko telah dihancurkan pada kamis siang barang dagangan seperti kain gorden batik dan beberapa tekstil lainnya dikumpulkan oleh warga dibantu personel tnibadan nasional penanggulangan bencana bnpb menetapkan status darurat bencana untuk provinsi bali selama satu pekan penetapan status darurat bencana itu menyusul terjadinya banjir yang merenggut korban jiwa di beberapa wilayah bali rabu 109baca juga banjir besar bali pakar ingatkan kelestarian lingkungan jangan diabaikanselengkapnya klik di sini video bicara soal banjir menteri lh soroti daerah aliran sungai bali video bicara soal banjir menteri lh soroti daerah aliran sungai bali femfem banjir bali bali banjir wisata bali,True
