author,keyword,link,publish_date,source,title,cleaned_content,is_valid
I Wayan Selamat Juniasa - detikBali,banjir klungkung bali,https://www.detik.com/bali/berita/d-6814580/243-titik-bencana-renggut-5-korban-jiwa-di-bali,2023-07-10 10:01:00,detik.com,"
        243 Titik Bencana Renggut 5 Korban Jiwa di Bali    ",daftar isi kakek dan cucu tewas tertimbun korban pasutri di bangli 243 titik bencana di seluruh bali warga mengeluh gatalgatal bagikan ribuan nasi bungkus bangun jembatan darurat karangasemklungkung denpasar badan penanggulangan bencana daerah bpbd mencatat ada 243 titik bencana sejak hujan deras disertai angin kencang melanda wilayah bali selama beberapa hari terakhir total ada lima orang yang meninggal akibat bencana tersebutkorban terakhir adalah ni nyoman ririg 65 dia mengembuskan napas terakhir saat dirawat di rsup prof ngoerah denpasar minggu 972023 ririg merupakan satu korban tanah longsor di banjar dinas ngis kaler desa tribuana kecamatan abang kabupaten karangasem bali yang terjadi jumat 772023baca juga lima temuan ular di denpasar dan hujan berharihari karena bayi kembar 3dengan meninggalnya ririg korban meninggal akibat longsor di karangasem bertambah menjadi tiga orang ditambah korban meninggal akibat longsor di bangli total ada lima korban jiwa di seluruh bali scroll to continue with content kabar meninggalnya ririg dibenarkan oleh perbekel desa tribuana i nyoman kerti ia menjelaskan ririg ditemukan tertimbun longsor pada jumat pagi ririg langsung dilarikan menuju rsud karangasem dan dirujuk ke rsup prof ngoerah denpasar lantaran kondisinya semakin melemahsetelah kurang lebih dua hari dirawat intensif tadi pagi sekitar pukul 0500 wita korban dinyatakan meninggal dunia kata kerti minggu advertisement kakek dan cucu tewas tertimbunlongsor di desa tribuana terjadi pada kamis 672023 malam material longsor menimbun rumah dengan tiga orang penghuni termasuk ririg dua orang lainnya yang juga tertimbun longsor adalah suami ririg yakni i ketut tunas 70 dan sang cucu bernama i komang aditya 14suami dan cucu ririg sebelumnya sudah dinyatakan meninggal dunia jasad mereka ditemukan tertimbun reruntuhan dengan demikian maka jumlah korban jiwa akibat tanah longsor di desa tribuana menjadi tiga orangbaca juga korban tewas karena longsor di karangasem bertambah jadi 3 orangkerti menuturkan keluarga telah menggelar upacara penghormatan terakhir atau ngaben terhadap tunas dan aditya sedangkan jasad ririg juga akan diupacarai pada minggu soredua korban sebelumnya yaitu i ketut tunas dan i komang aditya sudah lebih dulu dibakar kemarin sedangkan ni nyoman ririg yang baru saja dinyatakan meninggal rencananya sore ini juga akan dibakar kata kertikorban pasutri di bangliselain longsor di karangasem rumah satu keluarga di kelurahan cempaga kecamatankabupaten bangli bali tertimpa tanah longsor dan pohon tumbang jumat 772023 malam dua orang yang merupakan pasangan suami istri pasutri meninggal akibat tertimbun tanah longsorkepala pelaksana bpbd dan pemadam kebakaran kabupaten bangli wayan wardana menegaskan tim gabungan lebih dulu menyelamatkan tujuh korban mereka sudah dievakuasi ke rumah kerabat pada jumat pukul 2130 witasementara dua korban lainnya masih tertimbun longsor beberapa jam mereka adalah ida bagus eka widya cipta 40 dan istrinya ida ayu putu mutiari 38baca juga warga klungkungdenpasar kesulitan air bersih dampak longsorbanjir bandangpencarian korban melibatkan tim gabungan bpbd bangli tnipolri dan dinas pekerjaan umum bangli menggunakan dua unit alat berat eskavator milik pu dan satu mobil damkar jenazah pasutri itu baru ditemukan pukul 0200 wita sabtu 872023jenazah sudah langsung dibawa ke rsud bangli tim gabungan melanjutkan penanganan di lokasi pembersihan sisa lumpur dengan alat berat evakuasi barang korban sedangkan tujuh orang yang berhasil selamat saat ini mengungsi ke rumah kerabat jelas wardana dalam siaran pers sabtuadapun korban selamat di antaranya anak agung sumiati 60 ida ayu trisna mirayanti 19 ida ayu manik astiti 60 ida ayu sriwartini 51 ida ayu made astini 67 serta dua korban anakanak yakni iaed 8 dan ibep 12 sebagian besar korban alami lukaluka memar dan lecet243 titik bencana di seluruh balibpbd bali mencatat 243 titik bencana yang tersebar di berbagai kabupatenkota di bali dengan kerugian mencapai rp 2 miliardata yang kami miliki sampai kemarin pukul 2300 wita lebih dari 243 titik kebencanaan di seluruh bali yang masih kami pantau relatif nihil ada di buleleng kata kepala bpbd bali i made rentin saat ditemui di kantor bpbd provinsi bali minggubaca juga longsor maut di bali berujung jatuhnya 4 korban jiwarentin menuturkan estimasi kerugian mencapai rp 2 miliar itu berdasarkan penghitungan terhadap infrastruktur yang rusak akibat bencana mulai dari pura yang tertimpa pohon tumbang banjir bandang hingga tanah longsorkerugian ini tentu masih bersifat dinamis rp 2 miliar kebanyakan kerusakan infrastruktur imbuhnyarentin mengungkapkan sejumlah warga juga harus dievakuasi ke pengungsian seperti warga yang bermukim di bantaran sungai unda kabupaten klungkung akibat air sungai meluap sebanyak 17 kepala keluarga kk yang terdiri dari 34 jiwa diungsikan ke balai budaya klungkungselain itu sejumlah warga di kabupaten jembrana juga sempat mengungsi akibat banjir berdasarkan data dari bpbd bali terdapat enam titik banjir di jembrana yaitu desa kaliakah jalan sahadewa kelurahan banjar tengah jalan ngurah rai kota negara lingkungan awen kelurahan lelateng desa pengambengan dan jalan sudirman menurut rentin para pengungsi sudah kembali ke rumah masingmasing dan melakukan pembersihan secara mandiriberkaitan dengan logistik kami tentu menyiapkan bantuan berkaitan dengan makanan siap saji kamu ingin masyarakat yang mengungsi bisa nyaman menyiapkan kebutuhan pokok air jelas rentinwarga mengeluh gatalgatalwarga di dusun munduk desa pengambengan kecamatan negara jembrana bali mulai mengeluhkan gatalgatal setelah rumah mereka terendam banjir selama dua hari salah satu warga setempat yuliana menyebut banjir kali ini adalah yang terparah dalam beberapa tahun terakhir menurutnya ketinggian ketinggian mencapai lebih dari 1 meterbanjir memang sering terjadi tetapi tahun ini 2023 adalah yang paling parah airnya sangat tinggi lebih dari satu meter kemarin air masih tinggi dan hari ini sudah mulai surut tingginya sekitar 30 sentimeter ungkap yuliana saat ditemui detikbali minggubaca juga lalat hijau jadi petunjuk korban longsor ditemukan tewas di reruntuhanwarga di dusun tersebut juga mulai melakukan pembersihan terhadap rumah mereka kebetulan cuaca hari ini cukup cerah warga pun memanfaatkan sinar matahari untuk menjemur perlengkapan tidur seperti kasur dan pakaian yang terendam banjir di pagar rumah merekaselain merasa gatalgatal yuliana mengungkapkan warga juga membutuhkan pasokan air bersih untuk kebutuhan seharihari aktivitas warga sangat terganggu banyak yang mengeluhkan gatalgatal akibat banjir ini imbuhnyawarga lainnya warno setali tiga uang pria berusia 29 tahun itu mulai membersihkan barangbarang di dalam rumahnya yang sempat tergenang air dampaknya paling parah kali ini semua peralatan elektronik rusak seperti televisi kulkas dan peralatan elektronik lainnya ujar warnobagikan ribuan nasi bungkusperbekel desa pengambengan kamaruzzaman menjelaskan seluruh kebutuhan warga terdampak banjir sudah mendapat bantuan dari pemerintah kabupaten jembrana termasuk makanan dan air bersih menurutnya dapur umum di kantor desa setiap harinya menyiapkan sekitar 2000 hingga 2500 bungkus nasi untuk dibagikan kepada wargaada juga 5 titik tandon air bersih yang disuplai langsung oleh pemerintah kata kamaruzzamankamaruzzaman akan berkoordinasi dengan puskesmas ii negara terkait keluhan warga yang merasa gatalgatal setelah rumah mereka tergenang air beberapa warga mengeluhkan gatalgatal kami sudah meminta bantuan dari puskesmas dan mengarahkan warga untuk melakukan pemeriksaan tandas kamaruzzamanbangun jembatan darurat karangasemklungkungterjangan banjir pada jumat malam menjebol jembatan penghubung antara kabupaten karangasem dengan klungkung di desa tangkup kecamatan sidemen kabupaten karangasem kini dinas pupr dan perkim kabupaten karangasem langsung bergerak cepat untuk membangun jembatan darurathal tersebut dilakukan agar masyarakat bisa melintas di jembatan tersebut mengingat selama ini akses jalan yang putus tersebut merupakan akses utama masyarakat yang ada di desa tangkup dan sekitarnyabaca juga 6 alat berat terimbun longsorpuluhan hektare sawah terancam gagal panenwarga karangasem itu biasanya menyeberang ke klungkung untuk berbelanjar ke pasar ke sekolah maupun berobat karena jaraknya lebih dekatkami buatkan jembatan darurat supaya minimal bisa dilalui oleh sepeda motor sehingga aktivitas masyarakat tidak lumpuh total karena ini merupakan akses utama dan terdekat bagi masyarakat untuk menuju ke kabupaten klungkung kata kabid bina marga dinas pupr dan perkim kabupaten karangasem i wayan surata jaya minggudia berharap jembatan bisa rampung minggu sore karena senin 1072023 pagi para siswa sudah mulai bersekolah bahan yang digunakan adalah batang kelapa dan kayu yang ditata dia menjamin jembatan aman untuk dilalui sepeda motorfoto dinas pupr dan perkim kabupaten karangasem yang dibantu masyarakat membangun jembatan darurat minggu 972023 dok dinas pupr dan perkim karangasemsedangkan proses perbaikan jembatan permanen belum bisa dilakukan dalam waktu dekat surata menyebut proses itu masih dikaji dan dikoordinasikan dengan pu provinsi karena dulu yang membangun jembatan tersebut adalah pemprov balisementara itu perbekel desa tangkup i gede sukardinata mengaku sangat bersyukur dengan dibangunnya jembatan darurat tersebut oleh pemkab karangasemsaya mewakili masyarakat mengucapkan terima kasih karena pemerintah sudah cepat dan tanggap dalam merespon keluhan dari warga karena jembatan tersebut merupakan akses utama masyarakat menuju ke kabupaten klungkung kata sukardinata cuaca buruk kapal bongkar muat batubara karam di perairan banyuasin cuaca buruk kapal bongkar muat batubara karam di perairan banyuasin hsagsp banjir dan longsor di bali cuaca buruk bpbd bali longsor di karangasem longsor di bangli bencana di bali korban bencana di bali,True
Rizki Setyo Samudero - detikBali,banjir klungkung bali,https://www.detik.com/bali/berita/d-6822467/dinas-sosial-bali-suplai-3-ribu-bantuan-untuk-korban-banjir-tanah-longsor,2023-07-14 13:39:00,detik.com,"
        Dinas Sosial Bali Suplai 3 Ribu Bantuan untuk Korban Banjir-Tanah Longsor    ",denpasar dinas sosial bali mengirimkan bantuan logistik untuk korban banjir dan tanah longsor sebanyak 3 ribu bantuan seperti bahan pokok selimut hingga pakaian dikirim ke sejumlah daerah di pulau dewata yang terkena bencanaada 14 jenis bantuan seperti makanan siap saji makanan anak kasur selimut peralatan dapur sandang dewasa tenda gulung dan sembako bahan pokok tutur kepala dinas sosial bali luh ayu aryani kepada detikbali jumat 1472023baca juga 243 titik bencana renggut 5 korban jiwa di baliayu menerangkan sebanyak 1405 keluarga dari lima kabupaten telah menerima bantuan tersebut rinciannya di tabanan sebanyak 121 keluarga karangasem 19 klungkung 8 dan bangli 6 scroll to continue with content penerima bantuan terbanyak di jembrana 1215 keluarga ujar ayu aryanisebelumnya badan penanggulangan bencana daerah bpbd mencatat ada 243 titik bencana seperti banjir dan longsor sejak hujan deras disertai angin kencang melanda wilayah bali selama beberapa hari terakhir pada pekan lalu sebanyak lima orang yang meninggal karena bencana tersebut advertisement baca juga bpbd usulkan santunan rp 15 juta per orang untuk 3 korban tewas longsoradapun kerugian akibat bencana tersebut mencapai rp 2 miliar kerugian tersebut berdasarkan penghitungan terhadap infrastruktur yang rusak akibat bencana mulai dari pura yang tertimpa pohon tumbang banjir bandang hingga tanah longsorkerugian ini tentu masih bersifat dinamis rp 2 miliar kebanyakan kerusakan infrastruktur ungkap kata kepala bpbd bali i made rentin di kantornya minggu 972023 video seputar fenomena gelombang rossby yang picu hujan dan banjir di bali video seputar fenomena gelombang rossby yang picu hujan dan banjir di bali gspiws banjir dan longsor di bali dinas sosial bali bpbd bali cuaca buruk,True
I Putu Adi Budiastrawan - detikBali,banjir klungkung bali,https://www.detik.com/bali/berita/d-6801996/kapal-terseret-arus-di-selat-bali-hati-hati-cuaca-buruk,2023-07-02 14:21:00,detik.com,"
        Kapal Terseret Arus di Selat Bali, Hati-hati Cuaca Buruk    ",jembrana cuaca buruk kembali melanda perairan selat bali hujan dan gelombang tinggi mengakibatkan terganggunya aktivitas penyeberangan dari pelabuhan gilimanuk jembrana bali menuju pelabuhan ketapang banyuwangi maupun sebaliknyabahkan kapal motor penumpang kmp nusa makmur sempat terseret arus saat hendak berlayar dari gilimanuk menuju ketapang pada sabtu 172023 siang setelah dievakuasi kapal tersebut akhirnya diberangkatkan dengan kondisi kosongbaca juga waspada 24 pantai di bali berpotensi diterjang banjir rob 58 juli 2023kemarin memang ada salah satu armada kapal terseret arus sekitar pukul 1330 wita kemudian pukul 1546 wita berhasil dievakuasi dan bertolak ke pelabuhan ketapang tanpa penumpang ungkap koordinator satuan pelaksana badan pengelola transportasi darat bptd pelabuhan gilimanuk i nyoman agus sugiarta minggu 272024 scroll to continue with content agus mengimbau kepada seluruh penyedia jasa transportasi laut untuk selalu memperhatikan keselamatan penumpang menurutnya cuaca di selat bali dapat berubah secara tibatibacuaca saat ini masih tidak mendukung gelombang serta arus yang cukup kuat kami sudah imbau seluruh perusahaan kapal agar selalu mengutamakan keselamatan ujar agus advertisement agus menjelaskan kondisi pelabuhan gilimanuk saat ini masih ramai lancar ia menegaskan penyeberangan di selat bali akan ditunda jika cuaca tak memungkinkan untuk melakukan pelayarankami tetap memantau cuaca di selat bali namun jika situasi tidak memungkinkan kami akan lakukan penundaan penyeberangan tandas agussebelumnya kepala bidang data dan informasi balai besar meteorologi klimatologi dan geofisika bmkg wilayah iii denpasar i nyoman gede wiryajaya mengimbau warga bali yang berada di pesisir untuk waspada terhadap potensi banjir pesisir atau rob pada 58 juli 2023 potensi banjir rob itu menyusul fenomena full moon dan perigeeberdasarkan pantauan data water level dan prediksi pasang surut banjir pesisir rob berpotensi terjadi di beberapa wilayah pesisir bali ujar wiryajaya minggu 272023baca juga hujan deras senderan jebolrumah warga tertimpa pohon tumbangmenurut wiryajaya fenomena bulan purnama full moon pada 3 juli 2023 bersamaan dengan perigee atau jarak terdekat bulan ke bumi pada 4 juli 2023 fenomena itu berpotensi meningkatkan ketinggian pasang air laut maksimum adapun banjir rob berpotensi terjadi di beberapa wilayah pesisir bali di antaranya pesisir wilayah tabanan badung denpasar gianyar dan klungkungselain itu wilayah bali bagian barat tengah selatan dan timur juga berpotensi hujan ringan hingga sedang pada 57 juli 2023 bmkg menyebut terdapat pola pertemuan angin konsfluensi di samudera hindia selatan bali hingga ntb hal tersebut mendukung pertumbuhan awanawan hujan di wilayah bali video h7 lebaran lonjakan pemudik di pelabuhan gilimanuk tembus 53 persen video h7 lebaran lonjakan pemudik di pelabuhan gilimanuk tembus 53 persen iwsbir pelabuhan gilimanuk selat bali kapal terseret arus berita jembrana berita bali terkini,True
Rizki Setyo Samudero - detikBali,banjir klungkung bali,https://www.detik.com/bali/berita/d-6811761/bpbd-bali-catat-78-bencana-alam-lantaran-hujan-lebat-2-hari-1-tewas,2023-07-07 20:19:00,detik.com,"
        BPBD Bali Catat 78 Bencana Alam lantaran Hujan Lebat 2 Hari, 1 Tewas    ",denpasar badan penanggulangan bencana daerah bpbd bali mencatat ada 78 bencana akibat hujan lebat yang mengguyur sejumlah wilayah bali sejak kamis 672023 hingga jumat 772023 rinciannya 31 titik pohon tumbang 12 titik banjir 29 titik tanah longsor empat titik bangunan rusak dan satu titik jalan rusakkepala bpbd bali i made rentin menuturkan bencana tersebut mengakibatkan dua orang luka dan satu meninggal satu orang lagi masih dalam pencarian tuturnya kepada detikbali jumatbaca juga sungai pangyangan meluap jalur gilimanukdenpasar lumpuhrentin menerangkan tanah longsor dan pohon tumbang karena hujan lebat paling banyak terjadi di kabupaten gianyar dengan 28 musibah kerugian akibat bencana tersebut ditaksir mencapai puluhan juta rupiah scroll to continue with content di badung rentin melanjutkan terdapat 19 bencana rinciannya enam lokasi longsor delapan pohon tumbang dua titik banjir hingga tiga bangunan robohrentin menerangkan di bangli terdapat 15 bencana alam karena hujan lebat tak ada korban jiwa akibat peristiwa tersebut advertisement baca juga hujan lebat 2 hari banjirlongsor terjang sejumlah wilayah di balidi jembrana rentin menuturkan ada enam titik banjir dan tiga lokasi pohon tumbang sedangkan di karangasem terjadi dua bencana tanah longsor yakni di dusun ngis kaler desa tribuana kecamatan abang dan banjar dinas segeha desa bunutan kecamatan abang kejadian tersebut mengakibatkan satu orang meninggal duniarentin menambahkan di klungkung hujan deras mengakibatkan sungai unda meluap adapun di denpasar hanya terdapat satu pohon tumbang di jalan drupadidi buleleng nihil kejadian bencana alam tutur rentin video seputar fenomena gelombang rossby yang picu hujan dan banjir di bali video seputar fenomena gelombang rossby yang picu hujan dan banjir di bali gsphsa bpbd bali cuaca buruk hujan tanah longsor banjir pohon tumbang banjir dan longsor di bali,True
"Rizki Setyo Samudero, I Putu Adi Budiastrawan - detikBali",banjir klungkung bali,https://www.detik.com/bali/berita/d-6813990/update-bpbd-bali-catat-243-titik-bencana-kerugian-mencapai-rp-2-miliar,2023-07-09 18:34:00,detik.com,"
        Update! BPBD Bali Catat 243 Titik Bencana, Kerugian Mencapai Rp 2 Miliar    ",denpasar badan penanggulangan bencana daerah bpbd bali menyampaikan data terbaru jumlah titik kejadian bencana akibat cuaca buruk yang melanda pulau dewata sejak beberapa hari terakhir tercatat sebanyak 243 titik bencana yang tersebar di berbagai kabupatenkota di bali dengan kerugian mencapai rp 2 miliardata yang kami miliki sampai kemarin pukul 2300 wita lebih dari 243 titik kebencanaan di seluruh bali yang masih kami pantau relatif nihil ada di buleleng kata kepala bpbd bali i made rentin saat ditemui di kantor bpbd provinsi bali minggu 972023baca juga korban tewas karena longsor di karangasem bertambah jadi 3 orangrentin menuturkan estimasi kerugian mencapai rp 2 miliar itu berdasarkan penghitungan terhadap infrastruktur yang rusak akibat bencana mulai dari pura yang tertimpa pohon tumbang banjir bandang hingga tanah longsor scroll to continue with content kerugian ini tentu masih bersifat dinamis rp 2 miliar kebanyakan kerusakan infrastruktur imbuhnyarentin mengungkapkan sejumlah warga juga harus dievakuasi ke pengungsian seperti warga yang bermukim di bantaran sungai unda kabupaten klungkung akibat air sungai meluap sebanyak 17 kepala keluarga kk yang terdiri dari 34 jiwa diungsikan ke balai budaya klungkung advertisement selain itu sejumlah warga di kabupaten jembrana juga sempat mengungsi akibat banjir berdasarkan data dari bpbd bali terdapat enam titik banjir di jembrana yaitu desa kaliakah jalan sahadewa kelurahan banjar tengah jalan ngurah rai kota negara lingkungan awen kelurahan lelateng desa pengambengan dan jalan sudirman menurut rentin para pengungsi sudah kembali ke rumah masingmasing dan melakukan pembersihan secara mandiriberkaitan dengan logistik kami tentu menyiapkan bantuan berkaitan dengan makanan siap saji kamu ingin masyarakat yang mengungsi bisa nyaman menyiapkan kebutuhan pokok air jelas rentinwarga mengeluh gatalgatalwarga di dusun munduk desa pengambengan kecamatan negara jembrana bali mulai mengeluhkan gatalgatal setelah rumah mereka terendam banjir selama dua hari salah satu warga setempat yuliana menyebut banjir kali ini adalah yang terparah dalam beberapa tahun terakhir menurutnya ketinggian ketinggian mencapai lebih dari 1 meterbanjir memang sering terjadi tetapi tahun ini 2023 adalah yang paling parah airnya sangat tinggi lebih dari satu meter kemarin air masih tinggi dan hari ini sudah mulai surut tingginya sekitar 30 sentimeter ungkap yuliana saat ditemui detikbali minggu 972023baca juga lalat hijau jadi petunjuk korban longsor ditemukan tewas di reruntuhanwarga di dusun tersebut juga mulai melakukan pembersihan terhadap rumah mereka kebetulan cuaca hari ini cukup cerah warga pun memanfaatkan sinar matahari untuk menjemur perlengkapan tidur seperti kasur dan pakaian yang terendam banjir di pagar rumah merekaselain merasa gatalgatal yuliana mengungkapkan warga juga membutuhkan pasokan air bersih untuk kebutuhan seharihari aktivitas warga sangat terganggu banyak yang mengeluhkan gatalgatal akibat banjir ini imbuhnyawarga lainnya warno setali tiga uang pria berusia 29 tahun itu mulai membersihkan barangbarang di dalam rumahnya yang sempat tergenang air dampaknya paling parah kali ini semua peralatan elektronik rusak seperti televisi kulkas dan peralatan elektronik lainnya ujar warnoperbekel desa pengambengan kamaruzzaman menjelaskan seluruh kebutuhan warga terdampak banjir sudah mendapat bantuan dari pemerintah kabupaten jembrana termasuk makanan dan air bersih menurutnya dapur umum di kantor desa setiap harinya menyiapkan sekitar 2000 hingga 2500 bungkus nasi untuk dibagikan kepada wargabaca juga kantor desa adatgudang bumdes di tabanan lenyap tergerus longsorada juga 5 titik tandon air bersih yang disuplai langsung oleh pemerintah kata kamaruzzamankamaruzzaman akan berkoordinasi dengan puskesmas ii negara terkait keluhan warga yang merasa gatalgatal setelah rumah mereka tergenang air beberapa warga mengeluhkan gatalgatal kami sudah meminta bantuan dari puskesmas dan mengarahkan warga untuk melakukan pemeriksaan tandas kamaruzzaman video seputar fenomena gelombang rossby yang picu hujan dan banjir di bali video seputar fenomena gelombang rossby yang picu hujan dan banjir di bali iwsiws bencana di bali bpbd bali banjir di jembrana korban longsor di bali banjir dan longsor di bali cuaca buruk,True
Putu Krista - detikBali,banjir klungkung bali,https://www.detik.com/bali/berita/d-6810223/detik-detik-sungai-unda-meluap-listrik-mati-34-warga-mengungsi,2023-07-07 07:31:00,detik.com,"
        Detik-detik Sungai Unda Meluap, Listrik Mati-34 Warga Mengungsi    ",klungkung warga di bantaran sungai unda kelurahan semarapura kangin kabupaten klungkung bali panik lantaran air sungai di sisi barat dan timur meluap pada kamis 672023 petang sekitar pukul 1830 wita air dengan cepat membanjiri rumahrumah warga di kawasan tersebut aliran listrik terputus sehingga wilayah tersebut gelap gulitasalah satu warga wayan gede arimbawa 25 menuturkan hujan deras sudah mengguyur kawasan tersebut sejak kamis sore akibatnya air sungai cau di sisi barat dan aliran sungai unda di sebelah timur perumahan warga meluap mereka bergegas menyelamatkan diri hingga tak bisa menyelamatkan barangbarang berharga di dalam rumahbaca juga sungai unda klungkung meluap 34 warga diungsikantetangga teriakteriak airnya gentuh banjir padahal waktu itu baru saja mau makan bersama keluarga di rumah akhirnya kami tidak jadi makan agar bisa selamat dari kepungan banjir tutur arimbawa kamis malam scroll to continue with content di tengah kepanikan itu petugas gabungan datang untuk melakukan pertolongan menurut arimbawa neneknya yang berusia 85 tahun digendong oleh anggota tni untuk dibawa ke pengungsian sementara itu anggota keluarga lainnya juga turut mengungsi ke balai budaya klungkung ida dewa agung istri kanya advertisement sekarang kami mengungsi sementara di balai budaya klungkung mudahmudahan air segera surut dan bisa pulang kami cuma bawa pakaian saja tidak bawa apaapa imbuh arimbawawarga lainnya i komang sudira menceritakan delapan orang anggota keluarganya juga langsung bergegas menyelamatkan diri saat sungai unda meluap pada kamis petang air naik karena aliran sungai sisi barat tertutup kayu besar yang melintang saya tidak berani menarik karena gelap dan air keruh tuturnyawarga dievakuasi akibat sungai unda meluap kamis 672023putu kristadetikbalimenurut sudira warga di bantaran sungai unda sudah sering mengungsi saat air sungai meluap terlebih saat musim hujan setiap tahun airnya pasti naik tapi kali ini lebih besar tingginya semeter sekitar sepaha sebutnyakepala pelaksana bpbd klungkung i putu widiada menyebut sebanyak 34 warga dari tujuh keluarga yang tinggal di bantaran sungai unda diungsikan ke balai budaya klungkung ida dewa agung istri kanya pada kamis malam di tempat pengungsian warga disediakan tempat tidur makanan dan minumansemua tim bergerak membantu agar masyarakat tertangani karena dari rumah mereka tidak bawa apaapa dan bahkan banyak yang belum makan kata widiadawidiada mengatakan tim bpbd akan terus memantau kondisi di bantaran sungai unda pada jumat pagi ini ia berharap air cepat surut dan warga bisa kembali pulang ke rumahnya mudahmudahan tidak banyak kerusakan tandas widiadabaca juga hujan angin akibatkan pohon tumbang hingga longsor di klungkung video motif penusukan di denpasar pelaku tersinggung ditatap korban video motif penusukan di denpasar pelaku tersinggung ditatap korban iwsiws sungai unda sungai unda meluap berita klungkung berita bali terkini,True
