author,keyword,link,publish_date,source,title,cleaned_content,is_valid
"I Wayan Selamat Juniasa, Putu Krista - detikBali",banjir klungkung bali,https://www.detik.com/bali/berita/d-6856372/volume-sampah-di-karangasem-dan-klungkung-meningkat-seusai-galungan,2023-08-03 11:17:00,detik.com,"
        Volume Sampah di Karangasem dan Klungkung Meningkat Seusai Galungan    ",karangasem volume sampah di sejumlah tempat pembuangan akhir tpa di wilayah karangasem dan klungkung bali meningkat setelah hari raya galungan sampah didominasi oleh sisasisa canang dan bekas sarana hari raya lainnyakepala dinas lingkungan hidup dlh kabupaten karangasem i nyoman tari mengungkapkan volume sampah di karangasem meningkat 25 persen dari galungan sebelumnya bahkan peningkatan sampah telah terjadi sejak h2 galunganbaca juga galungan phdi imbau tak bermusuhan karena beda pilihan politik scroll to continue with content saat harihari biasa volume sampah yang kami angkut menuju tpa butus itu sebanyak 40 ton kalau saat galungan meningkat 25 persen atau 10 ton kata tari kamis 382023untuk mengantisipasi penumpukan sampah di perkotaan petugas dlh karangasem melakukan pengiriman sampah menuju ke tpa butus sebanyak dua kali per hari pada harihari biasa mereka hanya mengerahkan satu truk dengan satu kali pengiriman sampah advertisement dua truk emergency yang kami punya juga ikut diterjunkan supaya semua sampah bisa terangkut dalam satu hari imbuh taripeningkatan volume sampah juga terjadi di kabupaten klungkung bahkan volume sampah seusai hari raya naik menjadi tiga kali lipat dari hari biasanyakepala dinas dlhp klungkung i ketut suadnyana menyebutkan 90 persen sampah yang terkumpul setelah galungan adalah sampah organik pengangkutan sampah ke tempat olah sampah setempat toss center gema santi di kusamba dilakukan dua kali yakni pagi dan sore harisesuai aturan yang sudah ditetapkan warga baru diizinkan mengeluarkan sampah nonorganik pada senin dan jumat saja selain hari itu yang diangkut adalah sampah organik tutur suadnyana kamisbaca juga berduyunduyun umat hindu bali berdoa di pura rayakan galungansuadnyana menjelaskan dlhp klungkung memiliki 14 truk dan enam mobil pikap untuk mengangkut sampah warga kota semarapura setiap harinya peningkatan volume sampah diprediksi masih terjadi hingga h2 galungan hal serupa juga akan terjadi seusai hari raya kuningan yang jatuh pada 12 agustus mendatangtadi pagi kami sudah mengambil sebanyak 21 truk sampah di perkotaan sisanya nanti sore lagi setengahnya tandas suadnyana video menteri lh targetkan sampah pascabanjir bali beres dalam 1 bulan video menteri lh targetkan sampah pascabanjir bali beres dalam 1 bulan iwsgsp galungan 2023 hari raya galungan sampah di bali berita klungkung berita karangasem berita bali terkini,True
Hilda Rinanda - detikJatim,banjir klungkung bali,https://www.detik.com/jatim/berita/d-7745607/duka-mendalam-iringi-pemakaman-4-korban-longsor-denpasar-di-magetan,2025-01-23 08:35:00,detik.com,"
        Duka Mendalam Iringi Pemakaman 4 Korban Longsor Denpasar di Magetan    ",magetan kesedihan membuncah tampak di tpu dukuh sruwuh desa pragak parang magetan ketika empat jenazah korban longsor di denpasar bali dimakamkan suasana hening menyelimuti prosesi seolah ikut merasakan kepedihan mendalam yang dirasakan keluarga korbanmuhammad nur hadi ayah dari didik setiawan tak kuasa menahan air matanya apalagi ketika peti jenazah anak keduanya tiba di rumah duka tubuhnya seakan tak sanggup menahan beban duka hingga ia sempat pingsannur hadi berusaha tegar meski hatinya remuk menerima kenyataan pahit ini scroll to continue with content kita mengikhlaskan kepergian anak saya didik setiawan sudah menjadi takdirnya yang penting jenazah sudah dimakamkan dengan layak ujar nur hadi dengan suara bergetar kepada wartawan rabu 2212024baca juga 4 jenazah korban longsor denpasar dimakamkan di magetankedatangan ambulans yang membawa jenazah keempat korban menjadi momen yang memilukan isak tangis keluarga pecah para tetangga dan kerabat hanya bisa mencoba menenangkan meski mereka pun sulit menahan air mata advertisement kapolsek parang akp sukarno menyampaikan rasa duka yang mendalam atas nama kapolres magetan akbp satria permana kami turut berduka mewakili bapak kapolres magetan yang saat ini sedang umrah semoga keluarga ikhlas dan tabah katanya penuh harusementara itu danramil 080404 parang kapten inf joko priadi turut hadir dalam pemakaman ia mengimbau masyarakat untuk selalu waspada menghadapi cuaca ekstrem yang dapat memicu bencanakita selalu menghimbau kepada masyarakat agar selalu waspada bencana seiring saat ini cuaca masih ekstrem tandasnyasementara itu pj gubernur jatim adhy karyono memberi santunan korban longsor masingmasing ahli waris mendapat rp 10 juta dari pemprov jatim dan rp 5 juta dari dprd jatimbaca juga pj gubernur jatim beri santunan 4 korban longsor denpasar asal magetanatas nama pemprov dan dprd jatim kami mengucapkan dukacita yang mendalam atas apa yang menimpa keluarga magetan di bali kata adhy rabu 2212025ada uang duka 10 juta tambahan dari dprd 5 juta dan ada bingkisan tentu ini tidak cukup namun paling tidak kami ingin merasakan beban yang sama imbuh adhyadhy berjanji seluruh biaya pengobatan korban lukaluka akan ditanggung pemprov jatim termasuk seluruh pengurusan jenazah hingga pemakaman menjadi tanggungan pemerintah semua tanggung jawab pemerintah ujar adhyadhy lalu meminta masyarakat untuk meningkatkan kewaspadaan di tengah meningginya curah hujan sebagai efek dari bencana hidrometeorologiini sedang puncakpuncaknya musim hujan hidrometeorologi kami harap masyarakat berhatihati dan waspada termasuk saat berwisata kita telah bersurat ke bnpb untuk modifikasi cuaca karena angin kencang dan banjir sudah terjadi di pasuruan mojokerto jember jombang trenggalek dan ponorogo tandas adhybencana longsor yang terjadi di kota denpasar dan kabupaten klungkung bali pada minggu 191 dan senin 201 membawa duka mendalam sebanyak sembilan nyawa melayang dalam peristiwa inidi denpasar lima buruh bangunan menjadi korban saat tertidur di kos mereka di jalan ken dedes ubung kaja sementara di banjar cempaka desa pikat klungkung empat warga yang sedang bermeditasi juga tewas tertimbun longsor video kondisi tebing longsor rusak sejumlah rumah di bogor video kondisi tebing longsor rusak sejumlah rumah di bogor irbhil longsor longsor di bali kecelakaan kerja longsor di denpasar buruh bangunan tertimbun longsor magetan,True
Ni Komang Ayu Leona Wirawan - detikBali,banjir klungkung bali,https://www.detik.com/bali/berita/d-7949896/cerita-korban-selamat-dari-maut-kapal-terbalik-di-nusa-lembongan,2025-06-05 13:13:00,detik.com,"
        Cerita Korban Selamat dari Maut Kapal Terbalik di Nusa Lembongan    ",klungkung kapal cepat the tanis yang mengangkut 89 penumpang terbalik di perairan nusa lembongan klungkung bali wisatawan selamat menceritakan suasana mencekam saat fast boat itu mengalami kecelakaan digulung ombakan nuur khairune nisa wisatawan asal yogjakarta menjadi salah satu korban peristiwa itu terjadi saat ia menempuh rute gili trawangan menuju sanur untuk menjalankan hobinya free divingsaat kejadian pada rabu 462025 kapal tengah transit di pelabuhan tanjung sanghyang desa lembongan kecamatan nusa penida scroll to continue with content baca juga viral boat terbalik di lembongan penumpang meloncat selamatkan diriketika keluar dari pelabuhan mesinnya kegilas ombak hingga air masuk ke boat akhirnya dek belakang itu banjir yang membuat penumpang panik dan maju ke depan mereka berteriak go out sedangkan saya dan penumpang lain di depan tidak tahu apaapa cerita ann kepada detikbali kamis 562025ann tidak menyangka kapal yang ditumpanginya akan mengalami insiden sekitar pukul 1630 wiya ia menyebut tidak ada kejanggalan sebelumnya dan kru kapal juga tidak memberikan informasi apa pun situasi di dalam kapal semakin mencekam karena kru tidak segera membukakan pintu keluar advertisement orangorang mulai memecahkan kaca dan palu emergensi yang ada di setiap kaca tidak bekerja maksimal beberapa orang jadinya inisiatif nendang kaca biar pecah lanjutnyaann menyebut sejumlah penumpang di bagian depan sempat berusaha menenangkan situasi dengan berteriak calm down agar kapal tidak semakin oleng posisi ann yang berada di dekat area tanpa jendela membuatnya bisa berkoordinasi dengan penumpang lain untuk memecahkan kaca sebagai jalur evakuasiketika air mulai memenuhi dek depan dan kapal miring ke kiri bantuan datang dari sebuah kapal penyelamat yang berada di sisi kanan kapal beberapa penumpang pun melompat ke kapal penyelamat untuk menyelamatkan diriair sudah masuk dek depan masuk dari jendela bagian kiri seperti ada air terjun masuk oke merasa ini harus keluar dan posisi saya saat keluar boat sudah setengahnya tenggelam tutur annpara penumpang menyelamatkan diri dengan berbagai cara ada yang mengapung di laut dan ditolong kapal lain ada pula yang berenang atau langsung melompat ke rescue boat setelah berhasil selamat mereka disambut warga dan diputuskan bermalam di lembongankarena banyak pecahan kaca banyak yang lukaluka saat evakuasi dan kebanyakan di bagian kaki tim medisnya juga mulai datang dan langsung menerima penanganan di lokasi walau merekanya chaos juga karena kaminya ada banyak katanyabaca juga detikdetik mencekam kapal cepat angkut 89 turis terbalik di nusa lembonganann dan korban lainnya saat ini masih berkoordinasi dengan pihak the tanis mereka difasilitasi tempat menginap dan makanan karena belum bisa melanjutkan perjalanan ke sanur akibat cuaca buruk bagi penumpang asing pihak kapal juga telah memberikan surat kronologi serta transportasi untuk membantu pengurusan paspor yang hilangpolisi memastikan seluruh 89 penumpang berhasil selamat dan tidak ada korban jiwa meski begitu kerugian materiil yang dialami para penumpang diperkirakan mencapai rp 25 miliar video kapal wisata di vietnam terbalik 38 orang tewas video kapal wisata di vietnam terbalik 38 orang tewas dpwdpw kapal terbalik nusa lembongan selamat dari maut wisatawan the tanis bali,True
Putu Krista - detikBali,banjir klungkung bali,https://www.detik.com/bali/bisnis/d-6849046/usaha-dodol-buah-banjir-pesanan-jelang-galungan,2023-07-30 11:01:00,detik.com,"
        Usaha Dodol Buah Banjir Pesanan Jelang Galungan    ",klungkung produsen dodol buah di desa besan kecamatan dawan klungkung bali kebanjiran pesanan permintaan dodol tak hanya datang dari toko oleholeh melainkan juga karena menjelang hari raya galungan yang jatuh pada rabu 282023ni nengah yuliati salah satu penjual dodol di desa tersebut bisa mendapat pesanan 6000 buah dodol per tiga hari ia menjual dodol berbagai varian rasa dari nangka pisang hingga salak menurutnya dodol nangka yang dijual seharga rp 700 per biji paling banyak diminati pelangganbaca juga kado galungan dari kadek agung sumbang 1 gol untuk bali unitedlalu dodol dari buah pisang peminatnya hanya orang tertentu dengan harga rp 900 per biji tutur yuliati minggu 3072023 scroll to continue with content yuliati juga membuat dodol berbahan dasar salak namun ia baru memproduksinya ketika harga salak sedang merosot di pasaranmenurut yuliati produksi dodol buah sangat tergantung dengan musim buah ia mengaku kewalahan menerima pesanan lantaran masih kesulitan mencari nangka yang akan diolah menjadi dodol advertisement ia pun terpaksa membeli bahan baku dodol dengan harga lebih mahal meski begitu yuliati menyebut dodol nangka buatannya cepat ludes setelah diproduksisering saya jatah setiap pelanggan agar semuanya dapat produksi dodol itu tidak cukup satu hari dodol yang siap dikemas butuh waktu tujuh hari produksi imbuhnyabaca juga harga cabai makin pedas jelang galungan pasar murah diburu asnyuliati mengaku baru menerima pesanan dari warga jika menjelang galungan selebihnya ia mendistribusikan dodol buatannya untuk dijual di toko oleholehkalau yang dadakan memesan tidak bisa saya kasih bukan menolak rezeki memang sekarang sedang banyak pesanan sementara cari buah nangka agak sulit tandasnya suasana perayaan galungan di tabanan bali suasana perayaan galungan di tabanan bali iwsiws hari raya galungan berita klungkung dodol buah berita bali terkini,True
"Sui Suadnyana, Leona Wirawan - detikBali",banjir klungkung bali,https://www.detik.com/bali/berita/d-8106618/hilang-saat-banjir-perempuan-50-tahun-di-gianyar-ditemukan-tewas,2025-09-11 11:01:00,detik.com,"
        Hilang Saat Banjir, Perempuan 50 Tahun di Gianyar Ditemukan Tewas    ",gianyar perempuan bernama ni ketut suweni 50 ditemukan tewas di sekitar sungai jalan pasekan desa batubulan kecamatan sukawati gianyar bali kamis 1192025 sekitar pukul 0900 wita suweni sebelumnya hilang saat banjirkepala bidang kedaruratan dan logistik badan penanggulangan bencana daerah bpbd gianyar gusti ngurah dibya presasta mengatakan suweni sebelumnya dilaporkan hilang oleh kepala dusun kadus tagtag desa guwang i wayan hendra pada rabu 1092025hilangnya sejak pukul 0300 wita dan terakhir berkabar mau ke pasar bulan untuk berjualan tetapi tak kunjung pulang dugaan terjebak banjir ungkap ngurah dibya saat dihubungi detikbali kamis 1192025 scroll to continue with content baca juga alat berat dikerahkan tangani longsor di gianyarklungkungsetelah dilaporkan hilang seorang warga desa guwang bernama lotring kemudian menemukan motor suweni di aliran sungai yang membentang dari pasekan desa batubulan hingga bermuara pantai gumicik desa ketewel kecamatan sukawati gianyar keluarga bersama tim bpbd gianyar kemudian melakukan penelusuran advertisement ngurah dibya menuturkan pencarian terhadap suweni dilakukan di aliran sungai mulai dari jembatan dekat villa bumi linggah namun upaya pencarian pada rabu 1092025 hingga pukul 2230 wita berakhir nihilkesulitan pencarian kemarin karena faktor penerangan dan medan yang curam dengan arus sungai masih deras hari ini sudah berhasil ditemukan bpbd gianyar dengan kondisi tidak bernyawa dan diantar ke rumah duka menggunakan armada pmi tambah ngurah dibyabaca juga akses ke gianyar lumpuh warga batubulan sebut banjir terparah seumur hiduptemuan jenazah suweni menambah daftar korban tewas akibat banjir di gianyar menjadi tiga orang sebelumnya sudah ada dua korban lain yang tewas yakni ni made latif 75 asal banjar peteluan desa temesi kecamatan gianyar dan ni made rupet 87 asal banjar lebih duur kaja desa lebih kecamatan gianyarnenek latif ini tidur dengan cucunya yang masih sekolah smp tibatiba tembok penyengker roboh menimpa tembok kamarnya korban pun tertimbun tembok dan tidak tertolong tetapi cucunya berhasil selamat saat ini jenazah korban dititip di rsu family husada jelas ngurah dibyaserupa dengan itu ni made rupet juga meninggal akibat tertimpa reruntuhan dari tembok pekarangan yang jebol sempat mendapat penanganan medis kemudian dinyatakan meninggal video aksi sadis 3 pekerja bunuh mandor di bali leher korban digergaji video aksi sadis 3 pekerja bunuh mandor di bali leher korban digergaji hsahsa gianyar banjir korban tewas bali,True
Putu Krista - detikTravel,banjir klungkung bali,https://travel.detik.com/travel-news/d-7729121/viral-nusa-penida-dilanda-banjir-bandang-longsor-crystal-bay-ditutup,2025-01-12 19:03:00,detik.com,"
        Viral Nusa Penida Dilanda Banjir Bandang-Longsor, Crystal Bay Ditutup    ",jakarta hujan deras di nusa penida menyebabkan kerusakan jalan dan longsor pantai crystal bay ditutup untuk keselamatan wisatawankawasan pulau nusa penida klungkung bali dilanda hujan deras selama tiga hari terakhir imbasnya akses jalan menuju objek wisata banyak yang rusak hingga tergerus longsorkapolsek nusa penida kompol ida bagus putra sumerta mengatakan beberapa titik sudah dipasang penanda bahaya dan garis polisi tujuannya agar pengendara berhatihati dan tidak ada korban jiwa scroll to continue with content kemarin kami sudah pasang garis polisi di jalan menuju objek wisata pantai cristal bay yang longsor pada posisi tanjakan satu sisi longsor dan itu berbahaya kata sumerta minggu 1212025selain pemasangan tanda bahaya polisi juga mengumumkan kepada warga dan wisatawan untuk waspada selama kondisi cuaca ekstrem melalui aparat di desa setempat dan media sosial cuaca buruk tapi tetap ramai kunjungan karena penyebrangan masih aman ujar sumerta advertisement sementara camat nusa penida i kadek yoga kusuma mengatakan banjir bandang sempat menerjang pantai penida di desa sakti nusa penidabaca juga dihajar hujan badai candi ratusan tahun di bali robohsituasi ini membuat destinasi wisata yang populer disebut crystal bay tersebut ditutup sementara hal ini untuk menjamin keselamatan wisatawan yang berwisata ke lokasi tersebutsudah ada himbauan dari desa adat untuk menutup sementara destinasi wisata untuk wisatawan sampai kondisi kembali kondusif ujar kadek yoga kusuma minggutingginya curah hujan membuat meningkatnya volume air dan menimbulkan banjir bandang dari sungaisungai yang bermuara di pantai penida desa sakti tidak hanya mengikis badan jalan pasir di crystal bay juga ikut tergerus akibat kuatnya arus banjirpenutupan kawasan crystal bay ini juga dikarenakan longsornya dindingsenderan jalan dan tebing di wilayah banjar batu kapit ruas jalan itu merupakan akses utama menuju crystal bay dan kondisinya sudah retakretak sehingga dianggap membahayakanbaca artikel selengkapnya di detikbali video melihat kondisi proyek lift kaca nusa penida yang disetop sementara video melihat kondisi proyek lift kaca nusa penida yang disetop sementara mslmsl nusa penida banjir bandang crystal bay longsor objek wisata bali,True
Putu Krista - detikBali,banjir klungkung bali,https://www.detik.com/bali/wisata/d-7728903/longsor-banjir-bandang-landa-nusa-penida-crystal-bay-ditutup-sementara,2025-01-12 13:41:00,detik.com,"
        Longsor-Banjir Bandang Landa Nusa Penida, Crystal Bay Ditutup Sementara    ",klungkung kawasan pulau nusa penida klungkung bali dilanda hujan deras selama tiga hari terakhir imbasnya akses jalan menuju objek wisata banyak yang rusak hingga tergerus longsorkapolsek nusa penida kompol ida bagus putra sumerta mengatakan beberapa titik sudah dipasang penanda bahaya dan garis polisi tujuannya agar pengendara berhatihati dan tidak ada korban jiwabaca juga longsor tutup akses jalan utama klungkunggianyar lalin lumpuhkemarin kami sudah pasang garis polisi di jalan menuju objek wisata pantai cristal bay yang longsor pada posisi tanjakan satu sisi longsor dan itu berbahaya kata sumerta minggu 1212025 scroll to continue with content selain pemasangan tanda bahaya polisi juga mengumumkan kepada warga dan wisatawan untuk waspada selama kondisi cuaca ekstrem melalui aparat di desa setempat dan media sosial cuaca buruk tapi tetap ramai kunjungan karena penyebrangan masih aman ujar sumertasementara camat nusa penida i kadek yoga kusuma mengatakan banjir bandang sempat menerjang pantai penida di desa sakti nusa penida situasi ini membuat destinasi wisata yang populer disebut crystal bay tersebut ditutup sementara hal ini untuk menjamin keselamatan wisatawan yang berwisata ke lokasi tersebut advertisement sudah ada himbauan dari desa adat untuk menutup sementara destinasi wisata untuk wisatawan sampai kondisi kembali kondusif ujar kadek yoga kusuma minggutingginya curah hujan membuat meningkatnya volume air dan menimbulkan banjir bandang dari sungaisungai yang bermuara di pantai penida desa sakti tidak hanya mengikis badan jalan pasir di crystal bay juga ikut tergerus akibat kuatnya arus banjirpenutupan kawasan crystal bay ini juga dikarenakan longsornya dindingsenderan jalan dan tebing di wilayah banjar batu kapit ruas jalan itu merupakan akses utama menuju crystal bay dan kondisinya sudah retakretak sehingga dianggap membahayakandengan pertimbangan keselamatan maka crystal bay ditutup sementara untuk pengunjung sampai batas waktu yang belum ditentukan menunggu koordinasi dengan dinas terkait untuk penanganannya pungkas yoga video hujan deras picu banjir bandang dan longsor di nepal 47 orang tewas video hujan deras picu banjir bandang dan longsor di nepal 47 orang tewas nornor longsor banjir bandang nusa penida crystal bay klungkung,True
Ni Made Lastri Karsiani Putri - detikBali,banjir klungkung bali,https://www.detik.com/bali/berita/d-6905914/pupr-kaji-opsi-drainase-vertikal-atasi-banjir-di-denpasar,2023-08-31 15:34:00,detik.com,"
        PUPR Kaji Opsi Drainase Vertikal Atasi Banjir di Denpasar    ",denpasar kota denpasar bali masih rawan banjir dinas pekerjaan umum dan permukiman rakyat pupr mulai mengkaji dan mempertimbangkan opsi drainase vertikal di beberapa titik rawan banjirkemungkinan kalau memang bisa drainase vertikal akan kami pakai di tahun 2024 atau paling lama di 2025 kata kepala bidang sumber daya air dinas pupr kota denpasar gandhi dananjaya suarka kamis 3182023dia mengatakan sedikitnya ada 7 titik daerah rawan banjir di denpasar pupr akan menggandeng universitas udayana untuk mengkaji kemungkinan memakai drainase vertikal scroll to continue with content menurutnya dalam pengkajian drainase vertikal tersebut pihaknya akan memastikan terlebih dahulu mengenai topografi kedalaman hingga kondisi air tanah di titik yang bakal dibuatkan drainase vertikalbaca juga warga klungkungdenpasar kesulitan air bersih dampak longsorbanjir bandangdrainase vertikal bakal difokuskan dulu di jalan pura demak dan bumi ayu karena itu yang paling parah seandainya berhasil maka akan difokuskan ke titik yang lain terangnya advertisement menurutnya kedua lokasi tersebut menjadi lokasi langganan banjir apabila hujan turun dengan intensitas tinggi dan lamasetiap hujan warga di sana pasti akan kebanjiran sehingga kenyamanan aktivitas ekonomi sosial terganggu di samping memang lingkungan mereka sangat tidak representatif untuk dijadikan pemukiman kata gandhigandhi juga menerangkan drainase vertikal dinilai efektif dalam mencegah banjir atau paling tidak mengurangi volume air ketika banjirsatu unit drainase vertikal bisa menelan biaya rp 50 jutabaca juga 243 titik bencana renggut 5 korban jiwa di baliselain itu dalam mencegah terjadinya banjir saat musim hujan dinas pupr melakukan berbagai upaya di antaranya melaksanakan pembersihan di titiktitik lokasi rawan banjirkemudian melakukan pengerukan penggelontoran dan pembersihan sampah di sungaisalah satu pr pekerjaan rumah kami adalah mengedukasi warga agar tidak membuang sampah ke sungai karena sungai bukan tempat pembuangan sampah sungai adalah kawasan yang suci sumber kehidupan sumber air minum dan sumber air bersih imbuhnya video macet denpasargilimanuk hingga 6 km gegara pohon tumbangtruk mogok video macet denpasargilimanuk hingga 6 km gegara pohon tumbangtruk mogok dpwhsa denpasar titik banjir di denpasar bali,True
