author,keyword,link,publish_date,source,title,cleaned_content,is_valid
Anggi Muliawati - detikNews,banjir klungkung bali,https://news.detik.com/berita/d-8106985/banjir-bali-anggota-komisi-viii-dpr-tak-bisa-lagi-salahkan-curah-hujan,2025-09-11 14:08:00,detik.com,"
        Banjir Bali, Anggota Komisi VIII DPR: Tak Bisa Lagi Salahkan Curah Hujan    ",jakarta anggota komisi viii dpr ri maman imanulhaq menyampaikan dukacita atas banjir bandang yang terjadi di bali maman mendesak adanya langkah konkret pemerintah untuk memperkuat sistem mitigasi bencana dan perlindungan sosial bagi masyarakat terdampakinnalillahi wa inna ilaihi rojiun kami sampaikan keprihatinan atas bencana alam yang terjadi di bali dan dukacita mendalam atas jatuhnya korban dalam musibah tersebut kata maman dalam keterangannya kamis 1192025kita tidak bisa lagi hanya menyalahkan curah hujan ekstrem banjir bali adalah alarm keras bahwa sistem mitigasi kesiapsiagaan serta perlindungan sosial kita masih lemah dan jauh dari kata ideal sambung dia scroll to continue with content baca juga data banjir bali korban tewas bertambah jadi 14 oranglegislator yang bermitra dengan bnpb ini menyebut bencana banjir bali bukan hanya akibat fenomena alam dia mengungkit soal kegagalan tata kelola risiko bencana advertisement maman lantas menyoroti masih minimnya sistem peringatan dini keterbatasan kesiapan sarana evakuasi dan lemahnya koordinasi lintas sektor dalam penanganan bencana akibatnya kata dia masyarakat menjadi pihak yang paling dirugikanbencana ini terjadi di pusat destinasi wisata dunia tetapi masyarakatnya justru tidak terlindungi secara memadai situasi ini memperlihatkan lemahnya integrasi antara kebijakan pembangunan dengan pengurangan risiko bencana jelasnyadia pun meminta pemerintah melakukan pemetaan ulang kawasan rawan banjir dan bencana hidrometeorologi di bali selain itu perlu adanya penguatan sistem peringatan dini berbasis komunitaspercepat distribusi bantuan sosial dan kompensasi bagi warga terdampak terutama pedagang kecil dan keluarga miskin lalu sediakan layanan pemulihan psikososial bagi korban yang kehilangan keluarga maupun mata pencaharian ungkapnyadan integrasikan program penanggulangan bencana dengan perlindungan sosial agar masyarakat tidak semakin terbebani akibat bencana imbuh diabaca juga bnpb tetapkan status darurat bencana banjir di bali selama sepekandia juga mengingatkan pemerintah daerah serius memperhatikan aspek pencegahan dengan melibatkan masyarakat khususnya dalam perencanaan penanggulangan bencanabali adalah wajah indonesia di mata dunia jika bencana yang berulang terus dibiarkan tanpa mitigasi dan perlindungan yang kuat maka bukan hanya rakyat yang menderita tetapi juga wibawa bangsa dipertaruhkan tuturnyabanjir di bali menyebabkan 14 orang tewas bpbd bali mencatat 120 titik banjir melanda tujuh kabupatenkota di bali rinciannya denpasar sebanyak 81 titik banjir gianyar 14 titik badung 12 titik tabanan delapan titik kemudian karangasem dan jembrana masingmasing empat titik dan klungkung satu titikdata sementara per kamis 11 september 2025 pukul 1100 wib total korban meninggal meninggal dunia yang sudah ditemukan berjumlah 14 jiwa kata kepala pusat data informasi dan komunikasi kebencanaan bnpb abdul muhari dilansir detikbali kamis 119tonton juga video satu keluarga di bali hilang setelah rumah mereka diterjang banjir di sinigambasvideo 20detik amwgbr banjir bali komisi viii dpr banjir di bali,True
Tim detikcom - detikNews,banjir klungkung bali,https://news.detik.com/berita/d-8106528/fakta-fakta-banjir-bali-9-orang-tewas-status-tanggap-darurat-bencana,2025-09-11 10:31:00,detik.com,"
        Fakta-fakta Banjir Bali: 9 Orang Tewas, Status Tanggap Darurat Bencana    ",jakarta sejumlah wilayah di bali diterjang banjir sampai saat ini 9 orang dilaporkan tewas akibat banjir hingga status tanggap darurat bencana diterapkanberdasarkan laporan badan nasional penanggulangan bencana bnpb 202 kepala keluarga kk atau 620 jiwa terdampak banjir akibat hujan deras yang mengguyur wilayah bali sejak selasa 992025 adapun wilayah yang terdampak banjir mencakup enam kabupatenkota yakni kota denpasar kabupaten jembrana gianyar klungkung badung dan tabananbaca juga banjir terjang bali anggota dpr soroti pembangunan masiftata lingkungan buruk scroll to continue with content kabid humas polda bali kombes ariasandy merinci 9 korban tewas akibat banjir empat orang tewas akibat banjir di wilayah polresta denpasar satu orang tewas di wilayah polres badung kemudian dua orang tewas di wilayah polres jembrana dan dua orang tewas di wilayah polres gianyar sementara itu enam orang masih hilangbanjir kota denpasar dan sekitarnya termasuk beberapa wilayah di bali terjadi dini hari tadi malam sampai menjelang siang tadi mengakibatkan banyaknya kerusakan bangunan dan korban jiwa maupun materiil ungkap ariasandy advertisement terjebak di mobilterseret arussalah satu korban tewas endang cafyaning ayu 42 ditemukan setelah hanyut terseret banjir di pasar pengosari jalan raya kerobokancanggu kelurahan kerobokan kaja kecamatan kuta utara badung bali jasadnya ditemukan terdampar di proyek vila yang berjarak 2 kilometer lebih dari titik ia dilaporkan hilangdilansir detikbali ayu sempat dilaporkan hilang akibat terseret arus banjir saat melintas di jembatan dekat pasar pengosari korban bersama suaminya jumaali 59 terjebak di dalam mobil saat air sungai tukad yeh poh yang meluap hingga menutupi jalan dan area pasarkorban sudah dievakuasi dan dibawa ke rumah sakit mangusada badung di kelurahan kapal ujar kapolsek kuta utara kompol i ketut agus pasek sudinaagus pasek menjelaskan suami ayu jumaali selamat dan tengah dirawat di rumah sakit saat itu arus sungai kuat menyeret mobilnya namun sang istri masih terjebak dalam mobil dan ikut terhempas bersama arus banjir dari utara ke arah selatanmenurut pasek jasad korban ditemukan setelah petugas proyek vila di kelurahan kerobokan kelod mengecek tembok pagar yang ambrol setelah didekati ada mayat perempuan dalam kondisi telanjang bulat tertimpa tembok robohsetelah laporan itu kami mengecek lokasi saat itu anak korban juga ikut mengecek ke lokasi saksi mengakui bahwa korban hanyut itu adalah ibunya yang terseret arus sungai di pasar pangosari kerobokan imbuh pasekbaca juga bmkg prediksi hujan masih terjadi di sebagian wilayah bali sampai pekan depanibu hamil jadi korban tewasibu hamil bernama nita kumalasari 23 juga menjadi korban tewas banjir bali nita yang tengah mengandung dua bulan terseret arus banjir di desa pengambengan kecamatan negara kabupaten jembrana bali pada rabu 109jasad nita ditemukan oleh warga di wilayah banjar munduk desa pengambengan kecamatan negara saat ditemukan korban sudah dalam kondisi meninggal duniakorban tidak ada lukaluka ini karena tenggelam korban sudah meninggal dunia almarhum hamil dua bulan ungkap direktur rsu negara dr ni putu eka indrawati saat dikonfirmasi detikbali rabu warga jembrana tewas tersetrum listrik saat banjirsementara itu seorang warga bernama i komang oka sudiastawa 38 asal desa dangintukaya jembrana ditemukan meninggal dunia setelah diduga tersetrum listrik di depan rumahnya rabu 109 dini hari ketika banjir terjadi komang oka awalnya terlihat oleh warga sekitar pukul 0300 wita hendak membuka pagar rumahnya yang tergenang banjirtibatiba korban terjatuh dan mengambang di genangan air saat itu air banjir di wilayah tersebut sangat tinggi bahkan merendam sebagian jalan denpasargilimanukkomang oka diduga tersetrum kabel listrik yang putus saat menggeser pagar warga yang hendak menolong juga merasakan sengatan listrik sehingga mereka mengurungkan niat dan segera meminta penghuni rumah untuk mematikan meteran listrik sebelum mengevakuasi korbankorban ditemukan sudah mengambang dan meninggal dunia memang ada sambungan kabel yang terputus saat ini jenazah korban masih dititipkan di ruang jenazah rsu negara sambil menunggu banjir di rumah korban surut ungkap sekda jembrana i made budiasa saat ditemui detikbali di lokasi banjir desa pengambengan rabu 1092025baca juga bnpb tetapkan status darurat bencana banjir di bali selama sepekanberikut 9 daftar korban tewas akibat banjir di bali berdasarkan data polda bali per rabu 1092025 petangdenpasar1 nadira perempuan 48 tahun2 ni wayan lenyot perempuan3 rio saputra lakilaki 20 tahun4 mrs x perempuanbadung1 endang cafyaning ayu perempuan 42 tahungianyar1 ni made latif perempuan 70 tahun2 ni made rupet perempuan 87 tahunjembrana1 komang oka sudiastawa lakilaki 34 tahun2 nita ulama perempuan 23 tahunstatus tanggap darurat bencanabadan nasional penanggulangan bencana bnpb menetapkan status tanggap darurat bencna di bali penetapan status tersebut ditetapkan selama sepekan ke depantadi diskusi semula tanggap darurat bencana itu akan ditetapkan dua minggu tetapi karena sigap bencananya ternyata tidak terlalu besar maka akan diralat menjadi cukup satu minggu kata kepala bnpb letjen tni suharyanto di denpasar rabu 1092025penetapan status darurat kata suharyanto bukan berarti situasi genting atau luar biasa penetapan status diperlukan agar pemerintah pusat bisa membantu penanganan dampak bencanasalah satu persyaratannya adalah pemerintah daerah meminta bantuan itu suratnya ada namanya siaga darurat dan tanggap darurat ujarnyatonton juga video polri bantu evakuasi warga terdampak banjir dan longsor di bali di sinigambasvideo 20detik halaman 2 dari 2 dekimk banjir bali bnpb banjir bali,True
"Sui Suadnyana, Rizki Setyo - detikBali",banjir klungkung bali,https://www.detik.com/bali/berita/d-8106813/dprd-bali-dorong-pembenahan-tata-kelola-di-hulu-imbas-banjir-parah,2025-09-11 12:52:00,detik.com,"
        DPRD Bali Dorong Pembenahan Tata Kelola di Hulu Imbas Banjir Parah    ",denpasar dewan perwakilan rakyat daerah dprd bali mendorong pemerintah provinsi maupun kabupatenkota agar segera membenahi tata kelola di hulu pembenahan perlu dilakukan setelah banjir parah di sejumlah daerah di bali pada rabu 1092025tata kelola di hulu harus dibenahi coba kita lihat sungaisungai dan gotgot diperkecil oleh pembangunan kata wakil ketua dprd bali ida gede komang kresna budi kepada detikbali kamis 1192025 sampaisampai jalan subak saja bisa hilang ungkapnyabaca juga banjir bali renggut 9 nyawa ibu hamil warga tersetrum korban ruko ambruk scroll to continue with content kresna menilai badan pertanahan nasional bpn bali seharusnya mengetahui batas sempadan dan semuanya harus terverifikasi menurutnya perlu adanya revitalisasi bangunanbangunan di sempadan sungai dari hulu ke hilir contohnya seperti toko di jalan sulawesikader partai golongan karya golkar itu mengatakan setiap kabupatenkota memiliki tanggung jawabnya masingmasing yang dikomandoi oleh pemprov bali penting sinergitas dibangun sambung kresna budi advertisement sebelumnya badan nasional penanggulangan bencana bnpb mencatat 120 titik banjir yang menerjang tujuh kabupatenkota di bali rinciannya denpasar sebanyak 81 titik banjir gianyar 14 titik badung 12 titik tabanan delapan titik kemudian karangasem dan jembrana masingmasing empat titik dan klungkung satu titiksementara itu sejumlah warga mengungsi di beberapa titik pos pengungsian bpbd bali menginformasikan 562 warga mengungsi dengan rincian 327 warga di kabupaten jembrana dan 235 warga di kota denpasar beber kepala pusat data informasi dan komunikasi kebencanaan bnpb abdul muhari dalam keterangan persnya kamis 1192025baca juga koster sebut curah hujan sangat tinggi jadi penyebab banjir di balibnpb juga merilis update korban tewas bencana banjir di bali pada rabu 1092025 berdasarkan data bnpb tercatat sebanyak 14 korban tewas dan dua masih dalam pencariandata sementara per kamis 11 september 2025 pukul 1100 wib total korban meninggal meninggal dunia yang sudah ditemukan berjumlah 14 jiwa dan yang masih dalam pencarian sebanyak dua warga terang abdul menurutnya dua korban yang hilang teridentifikasi di denpasar video dprd bali sidak kawasan tahura ada pabrik betonrumah warga video dprd bali sidak kawasan tahura ada pabrik betonrumah warga hsahsa dprd bali pembenahan tata kelola banjir bali bencana alam bali banjir,True
Isal Mawardi - detikNews,banjir klungkung bali,https://news.detik.com/berita/d-8106410/banjir-terjang-bali-anggota-dpr-soroti-pembangunan-masif-tata-lingkungan-buruk,2025-09-11 08:56:00,detik.com,"
        Banjir Terjang Bali, Anggota DPR Soroti Pembangunan Masif-Tata Lingkungan Buruk    ",jakarta banjir menerjang sejumlah wilayah di provinsi bali anggota dpr dapil bali i nengah senantara menyorot pembangunan masif yang kini terjadi di balibanjir karena pembangunan yang masif di banyak titik perubahan alih fungsi di banyak tempat yang terbaru coba perhatikan jalan raya padang galak atau ngurah rai jalan hangtuah itu semua areanya jalur hijau sekarang kenapa jadi beton semua ujar senantara ketika dihubungi kamis 1992025tak hanya di kota pembangunan masif juga terjadi di pedalaman kemudian kata senantara tata kelola lingkungan yang buruk turut menyumbang andil bali diterjang banjir scroll to continue with content baca juga bnpb peringatkan 3 provinsi ini siap siaga tangani bencanatata kelola lingkungan yang belum memadai kesannya masih menunggu masalah baru penanganan tidak ada upaya preventif termasuk juga sampah yang belum terkelola dengan baik tutur senantara advertisement senantara tak memungkiri banjir juga timbul karena cuaca diketahui beberapa hari terakhir hujan deras mengguyur pulau dewatamemang curah hujannya yang sangat tinggi dua hari hujan sangat lebat dengan petir yang menggelegar sambungnya sebelumnya badan nasional penanggulangan bencana bnpb mengatakan banjir melanda empat wilayah administrasi kota dan kabupaten di provinsi bali wilayah terdampak banjir berada di kabupaten jembrana gianyar tabanan klungkung dan kota denpasarbaca juga kemensos gerak cepat salurkan bantuan untuk korban banjir balibnpb mengatakan banjir di wilayah bali terjadi sejak selasa 99 malam banjir terjadi setelah hujan lebat mengguyur sejumlah wilayah semalam sejak pukul 2315 wibdi kabupaten jembrana banjir terjadi di beberapa titik bnpb juga mencatat banjir di jembrana menimbulkan dua korban jiwadata sementara yang diterima bnpb pada rabu 109 pukul 1130 wib menyebutkan dua warga meninggal dan 103 kk 200 jiwa terdampak di kabupaten jembrana kata kepala pusat data informasi dan komunikasi kebencanaan bnpb abdul muhari dalam keterangan kepada wartawan rabu 1092025bnpb juga mencatat 85 warga mengungsi di beberapa titik di kabupaten jembrana di antaranya pos balai desa yeh kuning 10 jiwa pos balai banjar yeh kuning 10 jiwa musala assidiqie 40 jiwa dan musala darul mustofa 25 jiwa sementara itu 104 keluarga dengan 423 jiwa terdampak banjir di kabupaten klungkung sejumlah wilayah lain yang terdampak banjir di bali saat ini masih dalam proses pendataanbnpb juga menjelaskan ada empat kecamatan di kota denpasar yang saat ini terdampak banjir wilayah yang kebanjiran itu berada di kecamatan denpasar timur denpasar utara denpasar selatan dan denpasar baratdi wilayah kabupaten jembrana banjir melanda kecamatan jembrana sedangkan daerah lain banjir kecamatan sukawati di kabupaten gianyar kecamatan kediri di kabupaten tabanan dan kecamatan dawan di kabupaten klungkungtonton juga video update korban banjir di bali 9 orang meninggal 6 hilang di sinigambasvideo 20detik halaman 2 dari 3 isaeva bali banjir pembangunan lingkungan dpr i nengah senantara,True
Ni Made Lastri Karsiani Putri - detikTravel,banjir klungkung bali,https://travel.detik.com/travel-news/d-8106324/dispar-bali-imbau-biro-wisata-hotel-aktif-informasikan-situasi-banjir-ke-wisatawan,2025-09-11 08:39:00,detik.com,"
        Dispar Bali Imbau Biro Wisata & Hotel Aktif Informasikan Situasi Banjir ke Wisatawan    ",jakarta kepala dinas pariwisata dispar bali i wayan sumarajaya meminta biro perjalanan wisata dan pengelola akomodasi untuk selalu memberikan informasi terkini kepada wisatawan imbauan itu dikeluarkan menyusul banjir yang melanda sejumlah wilayah di pulau dewata dan sempat mengganggu akses jalan menuju destinasi serta bandarakepada seluruh pengelola biro perjalanan wisata dan pengelola akomodasi agar selalu memberikan informasi kepada wisatawan tentang halhal yang mesti dilakukan jika berwisata di bali pada musim hujan dengan rutin memantau perkiraan cuaca bmkg kata sumarajaya dikutip dari detikbali kamis 1192025 badan nasional penanggulangan bencana bnpb menyebut banjir itu melanda enam kabupatenkota di bali yakni denpasar jembrana gianyar klungkung badung dan tabanan data sementara menunjukkan sembilan orang meninggal dunia dua orang masih hilang serta ratusan kepala keluarga terdampak scroll to continue with content saat ini bali ditetapkan dalam status tanggap darurat bencana status itu diberlakukan selama satu minggu operasional bandara internasional i gusti ngurah rai berjalan normal namun akses menuju bandara lumpuh begitu pula akses ke sejumlah destinasi wisata karena jalan rusak parah bahkan berlubang setelah banjir advertisement sumarajaya juga meminta agar pengelola daya tarik wisata dtw menyiapkan mitigasi bencana memasuki peralihan musim kemarau menuju musim hujan jika dilihat dari musim memang saat ini sudah mendekati musim hujan mulai oktober 2025 sampai nanti bulan maret 2026 adalah musim hujan bulan september ini mungkin sudah akan ada hujan sebagai permulaan musim kata sumarajayabaca juga pray for bali dilanda banjir terparah satu dekade 9 orang tewas turis dievakuasipengelola wisata alam wisata bahari dan wisata udara diminta ekstra waspada sumarajaya meminta seluruh pengelola dtw di bali untuk menyiapkan sumber daya yang dimiliki untuk mengantisipasi halhal yang tidak diinginkan saat peralihan musim terutama objek wisata yang berhubungan langsung dengan alam seperti wisata petualangan bahari maupun wisata udaradia mengatakan pengelola juga bisa menata area dtw agar tidak membahayakan keselamatan wisatawan yang berkunjung termasuk menghindari terjadinya pohon tumbang hingga membersihkan saluran drainase untuk mencegah banjirkepada seluruh pengelola biro perjalanan wisata dan pengelola akomodasi agar selalu memberikan informasi kepada wisatawan tentang halhal yang mesti dilakukan jika berwisata di bali pada musim hujan dengan rutin memantau perkiraan cuaca bmkg kata dia sumarajaya juga mengingatkan para wisatawan agar mematuhi aturan saat pelesiran di bali baik peraturan yang dikeluarkan oleh pemerintah aturanaturan yang ada di tempat menginap dan aturanaturan tempattempat wisatasaya yakin jika semua pihak sudah menjalankan tanggung jawabnya dengan baik mentaati segala aturan yang ada semua kan baikbaik saja akan tetapi kita harus mempersiapkan dari sekarang sebelum musim hujan mencapai puncaknya kata dia baca juga banjir bali pulau dewata darurat bencanaselengkapnya klik di sini video bicara soal banjir menteri lh soroti daerah aliran sungai bali video bicara soal banjir menteri lh soroti daerah aliran sungai bali femfem dispar bali banjir bali bali banjir,True
Rizki Setyo Samudero - detikBali,banjir klungkung bali,https://www.detik.com/bali/berita/d-8106143/bnpb-dan-pemprov-bali-tetapkan-darurat-bencana-banjir-selama-satu-pekan,2025-09-10 22:54:00,detik.com,"
        BNPB dan Pemprov Bali Tetapkan Darurat Bencana Banjir Selama Satu Pekan    ",denpasar badan nasional penanggulangan bencana bnpb dan pemerintah provinsi pemprov bali menetapkan status darurat bencana selama satu pekan penetapan status darurat bencana itu menyusul terjadinya banjir yang merenggut korban jiwa di beberapa wilayah bali rabu 1092025tadi diskusi semula tanggap darurat bencana itu akan ditetapkan dua minggu tetapi karena sigap bencananya ternyata tidak terlalu besar maka akan diralat menjadi cukup satu minggu ungkap kepala bnpb letjen tni suharyanto seusai rapat koordinasi di rumah jabatan gubernur bali jayasabha denpasar rabu malambaca juga analisis bmkg soal hujan deras hingga banjir di bali scroll to continue with content suharyanto mengimbau agar warga bali tidak panik dengan penetapan status darurat bencana ini dia juga menyampaikan kepada kepala daerah untuk tidak takut jika dinilai tidak mampu menangani bencana di daerahnyastatus darurat ini tidak ada kaitannya dengan kemampuan menangani bencana seorang pemimpin karena terkait bencana itu tidak ada pemimpin sehebat apapun bisa menangani bencana itu secara sendirian tutur suharyanto advertisement kepala bnpb letjen tni suharyanto bersama gubernur bali wayan koster seusai rapat koordinasi di rumah jabatan gubernur bali jayasabha denpasar rabu 1092025 malam foto rizki setyodetikbali suhartoyo menegaskan status darurat bukan berarti situasi genting atau luar biasa di suatu daerah menurutnya pemerintah pusat hingga kabupatenkota akan berkolaborasi memberikan bantuan kepada masyarakat yang terdampak banjir di baliia menerangkan penetapan status tanggap darurat diperlukan agar pemerintah pusat bisa membantu penanganan dampak bencana salah satu persyaratannya adalah pemerintah daerah meminta bantuan itu suratnya ada namanya siaga darurat dan tanggap darurat pungkasnya 9 orang tewasberdasarkan data per rabu petang banjir di sejumlah wilayah di bali mengakibatkan sebanyak sembilan orang tewas bnpb menyebut sejauh ini ada dua orang yang masih dinyatakan hilangsecara keseluruhan bnpb mencatat sebanyak 202 kepala keluarga kk atau 620 jiwa terdampak banjir akibat hujan deras yang mengguyur wilayah bali sejak selasa 992025 adapun wilayah yang terdampak banjir mencakup enam kabupatenkota yakni kota denpasar kabupaten jembrana gianyar klungkung badung dan tabananrinciannya korban tewas akibat banjir di denpasar sebanyak 5 orang jembrana 2 gianyar 1 dan badung 1 banjir juga mengakibatkan sebagian warga terpaksa mengungsi karena tempat tinggal mereka masih terendam banjirbaca juga banjir lumpuhkan listrik di sejumlah wilayah bali tiang robohkabel putusadapun rincian warga yang mengungsi akibat banjir meliputi di kabupaten jembrana sebanyak 85 jiwa mereka mengungsi di sejumlah posko di antaranya balai desa yeh kuning balai banjar yeh kuning musala assidiqie dan musala darul musthofasementara itu jumlah warga yang mengungsi di denpasar sebanyak 108 jiwa mereka tersebar di sejumlah titik pengungsian seperti sd 25 pemecutan banjar sedana merta ubung serta banjar dakdakan peguyangan halaman 2 dari 2 simak video video nana mirdad dan andrew white terjun langsung bantu korban banjir bali gambasvideo 20detik iwsiws banjir di bali korban banjir di bali bnpb status darurat bencana letjen tni suharyanto berita bali terkini gubernur bali wayan koster,True
